id,title,due_date,description,created_at,updated_at
663,Creative Arts 472,2020-02-11 14:45:36 UTC,Ut dolorum consequatur. Aut libero nobis. Vitae consequatur dolor.,2019-09-08 16:30:16 UTC,2019-09-08 16:30:16 UTC
664,Engineering 533,2019-11-06 16:05:34 UTC,Voluptas voluptate tenetur. Earum qui qui. Suscipit vel quisquam.,2019-09-08 16:30:16 UTC,2019-09-08 16:30:16 UTC
665,Communications 165,2020-03-25 00:37:50 UTC,Earum enim deleniti. Exercitationem eaque id. Harum eos impedit.,2019-09-08 16:30:16 UTC,2019-09-08 16:30:16 UTC
666,Medicine 136,2020-04-27 23:08:29 UTC,Qui atque exercitationem. Ea ut expedita. Quia aliquid rerum.,2019-09-08 16:30:16 UTC,2019-09-08 16:30:16 UTC
667,Health Science 327,2020-03-01 14:04:19 UTC,Nulla ut voluptatum. Aut alias sit. Doloremque ipsam suscipit.,2019-09-08 16:30:16 UTC,2019-09-08 16:30:16 UTC
668,Psychology 162,2020-04-10 17:16:47 UTC,Accusantium dolores soluta. Qui accusamus ea. Doloremque et rerum.,2019-09-08 16:30:16 UTC,2019-09-08 16:30:16 UTC
669,Computer Science 417,2019-12-13 07:44:08 UTC,Numquam eius dicta. Nisi qui numquam. Suscipit expedita ex.,2019-09-08 16:30:16 UTC,2019-09-08 16:30:16 UTC
670,Biomedical Science 523,2019-12-29 05:47:43 UTC,Corrupti repellat omnis. Incidunt saepe illum. Blanditiis adipisci sed.,2019-09-08 16:30:16 UTC,2019-09-08 16:30:16 UTC
671,Information Systems 282,2020-02-28 14:06:46 UTC,Sed dolorem quibusdam. Laboriosam dolorum impedit. Aperiam debitis consequuntur.,2019-09-08 16:30:16 UTC,2019-09-08 16:30:16 UTC
672,Business 261,2020-03-17 19:04:09 UTC,Velit tempora et. Cumque molestiae omnis. Odio et quis.,2019-09-08 16:30:16 UTC,2019-09-08 16:30:16 UTC
673,Law 140,2019-11-01 13:47:26 UTC,Consequatur totam et. Earum ut ut. Fugiat nulla non.,2019-09-08 16:30:16 UTC,2019-09-08 16:30:16 UTC
674,Medicine 531,2019-12-06 07:53:28 UTC,Aliquam sit culpa. Omnis nam excepturi. Quo odit dolores.,2019-09-08 16:30:16 UTC,2019-09-08 16:30:16 UTC
675,Arts 399,2019-10-11 20:12:55 UTC,Rem reprehenderit earum. Molestias rerum optio. Qui voluptatem molestiae.,2019-09-08 16:30:16 UTC,2019-09-08 16:30:16 UTC
676,Design 387,2020-06-04 19:18:33 UTC,Corrupti repudiandae suscipit. Laborum in neque. Ut aliquam magnam.,2019-09-08 16:30:16 UTC,2019-09-08 16:30:16 UTC
677,Criminology 283,2020-04-29 23:21:47 UTC,Occaecati vel officiis. Aut tempora laborum. Consequuntur est ut.,2019-09-08 16:30:16 UTC,2019-09-08 16:30:16 UTC
678,Engineering 548,2020-02-14 19:56:45 UTC,Iure assumenda ad. Vitae esse illo. Enim aliquid harum.,2019-09-08 16:30:17 UTC,2019-09-08 16:30:17 UTC
679,Creative Arts 260,2020-06-12 21:26:47 UTC,Voluptas cupiditate eum. Nam dignissimos cumque. Ab aliquam similique.,2019-09-08 16:30:17 UTC,2019-09-08 16:30:17 UTC
680,Computer Science 561,2019-11-16 05:13:36 UTC,Rerum natus aspernatur. Et amet impedit. Non dolor et.,2019-09-08 16:30:17 UTC,2019-09-08 16:30:17 UTC
681,Commerce 491,2020-03-15 20:19:14 UTC,Ut officiis veniam. Tenetur voluptas corporis. Aspernatur facilis quos.,2019-09-08 16:30:17 UTC,2019-09-08 16:30:17 UTC
682,Forensic Science 380,2020-04-27 11:19:19 UTC,Dolorem non adipisci. Tenetur odit officia. Rerum veniam et.,2019-09-08 16:30:17 UTC,2019-09-08 16:30:17 UTC
683,Architectural Technology 563,2019-11-23 21:33:03 UTC,Sapiente ut magni. Eum facilis architecto. Id repellendus ab.,2019-09-08 16:30:17 UTC,2019-09-08 16:30:17 UTC
684,Creative Arts 589,2020-01-05 09:22:35 UTC,Voluptatibus temporibus rerum. Ratione quisquam omnis. Vitae animi corporis.,2019-09-08 16:30:17 UTC,2019-09-08 16:30:17 UTC
685,Applied Science (Psychology) 466,2020-05-22 13:18:53 UTC,Ab exercitationem ullam. Dicta eveniet et. Vero aut saepe.,2019-09-08 16:30:17 UTC,2019-09-08 16:30:17 UTC
686,Arts 162,2019-12-17 05:48:16 UTC,Et eaque sed. Cumque saepe iusto. Et sit assumenda.,2019-09-08 16:30:17 UTC,2019-09-08 16:30:17 UTC
687,Education 136,2020-02-28 02:07:35 UTC,Velit ut et. Provident a ut. Ad facere velit.,2019-09-08 16:30:17 UTC,2019-09-08 16:30:17 UTC
688,Commerce 428,2020-06-25 12:06:52 UTC,Sed omnis sunt. Aut molestiae eos. Omnis id non.,2019-09-08 16:30:17 UTC,2019-09-08 16:30:17 UTC
689,Criminology 377,2020-05-09 10:11:02 UTC,Molestiae et incidunt. Enim et dignissimos. Sint et at.,2019-09-08 16:30:17 UTC,2019-09-08 16:30:17 UTC
690,Psychology 283,2020-02-24 01:58:41 UTC,Et delectus debitis. Consequatur pariatur tempora. Corrupti perferendis aut.,2019-09-08 16:30:17 UTC,2019-09-08 16:30:17 UTC
691,Psychology 170,2020-06-15 21:02:17 UTC,Consequuntur error ea. Corrupti consequuntur sit. Qui similique a.,2019-09-08 16:30:17 UTC,2019-09-08 16:30:17 UTC
692,Engineering 180,2020-02-11 11:00:01 UTC,Sunt rerum ducimus. Voluptas odit in. Illum qui harum.,2019-09-08 16:30:17 UTC,2019-09-08 16:30:17 UTC
693,Design 347,2020-02-12 15:15:20 UTC,Harum aliquam beatae. Iure in facere. Omnis dolores iste.,2019-09-08 16:30:17 UTC,2019-09-08 16:30:17 UTC
694,Nursing 243,2020-02-14 03:22:36 UTC,Et voluptatem sunt. Minima voluptate architecto. Blanditiis accusamus est.,2019-09-08 16:30:17 UTC,2019-09-08 16:30:17 UTC
695,Criminology 223,2020-05-04 19:35:49 UTC,Accusantium est quia. Quidem sequi aut. Aut vero qui.,2019-09-08 16:30:17 UTC,2019-09-08 16:30:17 UTC
696,Arts 317,2020-01-13 05:53:57 UTC,Et dolor a. Ullam delectus illum. Corrupti qui illum.,2019-09-08 16:30:17 UTC,2019-09-08 16:30:17 UTC
697,Forensic Science 225,2019-10-12 00:21:17 UTC,Quae et cum. Nam repellat ut. Consequatur ut aperiam.,2019-09-08 16:30:17 UTC,2019-09-08 16:30:17 UTC
698,Arts 531,2019-12-25 01:28:57 UTC,Unde mollitia veniam. Facere et dicta. Omnis distinctio velit.,2019-09-08 16:30:17 UTC,2019-09-08 16:30:17 UTC
699,Architectural Technology 525,2019-12-27 02:59:53 UTC,Quibusdam consequatur ut. Quia voluptas et. Laborum sit consequatur.,2019-09-08 16:30:17 UTC,2019-09-08 16:30:17 UTC
700,Creative Arts 273,2020-03-26 21:30:26 UTC,Et minima quia. Sint autem dolor. Laborum sequi omnis.,2019-09-08 16:30:17 UTC,2019-09-08 16:30:17 UTC
701,Communications 335,2020-03-17 05:17:48 UTC,Ad ut necessitatibus. Occaecati modi tempora. Quibusdam est aperiam.,2019-09-08 16:30:17 UTC,2019-09-08 16:30:17 UTC
702,Nursing 134,2020-04-10 05:03:41 UTC,Commodi sint aliquam. Voluptatem voluptatum aut. Praesentium facere sint.,2019-09-08 16:30:17 UTC,2019-09-08 16:30:17 UTC
703,Criminology 242,2019-11-03 19:22:25 UTC,Consectetur rem voluptatum. Quis doloremque id. Quis hic sed.,2019-09-08 16:30:17 UTC,2019-09-08 16:30:17 UTC
704,Design 535,2019-10-09 17:40:38 UTC,Rerum eum qui. Id non sint. Dolor vitae ratione.,2019-09-08 16:30:17 UTC,2019-09-08 16:30:17 UTC
705,Criminology 214,2020-04-10 05:06:58 UTC,Ex id eveniet. Voluptatem consequatur reprehenderit. Vitae dolorum reprehenderit.,2019-09-08 16:30:17 UTC,2019-09-08 16:30:17 UTC
706,Health Science 354,2019-11-01 15:25:26 UTC,Non et consequatur. Est delectus laborum. Voluptatem dolorem ipsa.,2019-09-08 16:30:17 UTC,2019-09-08 16:30:17 UTC
707,Biomedical Science 294,2019-11-20 17:11:59 UTC,Rerum illum expedita. Numquam esse in. Atque voluptatem debitis.,2019-09-08 16:30:17 UTC,2019-09-08 16:30:17 UTC
708,Criminology 116,2020-03-13 11:00:52 UTC,Modi quo corrupti. Cumque doloribus vel. Magnam cumque voluptatem.,2019-09-08 16:30:17 UTC,2019-09-08 16:30:17 UTC
709,Criminology 356,2019-11-01 07:00:20 UTC,Sed suscipit et. Odio dolor laboriosam. Tenetur esse numquam.,2019-09-08 16:30:17 UTC,2019-09-08 16:30:17 UTC
710,Applied Science (Psychology) 210,2019-12-09 21:16:40 UTC,Sit expedita sit. Tempore qui eius. Minus maxime aliquid.,2019-09-08 16:30:17 UTC,2019-09-08 16:30:17 UTC
711,Education 175,2020-06-16 02:52:12 UTC,Ut quia et. Molestias dicta architecto. Est voluptas labore.,2019-09-08 16:30:17 UTC,2019-09-08 16:30:17 UTC
712,Health Science 522,2020-05-18 08:54:56 UTC,Nam deleniti magnam. Laboriosam rerum possimus. Qui reiciendis est.,2019-09-08 16:30:17 UTC,2019-09-08 16:30:17 UTC
713,Information Systems 332,2020-06-09 08:23:42 UTC,Dolorum ut ut. Maxime et reprehenderit. Maxime voluptatum ex.,2019-09-08 16:30:17 UTC,2019-09-08 16:30:17 UTC
714,Business 593,2020-02-06 09:24:10 UTC,Nemo ut debitis. Ut molestiae et. Vel dicta aut.,2019-09-08 16:30:17 UTC,2019-09-08 16:30:17 UTC
715,Creative Arts 479,2020-06-06 08:30:19 UTC,Ut ut quasi. Itaque placeat quasi. Sed voluptate officiis.,2019-09-08 16:30:17 UTC,2019-09-08 16:30:17 UTC
716,Design 187,2020-04-12 15:36:57 UTC,Amet itaque animi. Minima laboriosam inventore. Illum numquam excepturi.,2019-09-08 16:30:17 UTC,2019-09-08 16:30:17 UTC
717,Applied Science (Psychology) 329,2020-02-05 15:08:47 UTC,Eligendi voluptatem molestiae. Est id laboriosam. Similique error reiciendis.,2019-09-08 16:30:17 UTC,2019-09-08 16:30:17 UTC
718,Law 276,2019-11-23 14:10:20 UTC,Aliquam fugiat ea. Earum expedita aut. Doloribus est nemo.,2019-09-08 16:30:17 UTC,2019-09-08 16:30:17 UTC
719,Nursing 426,2019-10-25 19:10:21 UTC,Saepe natus ullam. Perspiciatis sit nisi. Est non veritatis.,2019-09-08 16:30:17 UTC,2019-09-08 16:30:17 UTC
720,Information Systems 380,2020-01-13 12:36:30 UTC,Adipisci quod quasi. Assumenda consequuntur incidunt. Nulla magni et.,2019-09-08 16:30:17 UTC,2019-09-08 16:30:17 UTC
721,Applied Science (Psychology) 526,2020-01-08 17:19:25 UTC,Temporibus quis et. Officia eveniet labore. Explicabo quos et.,2019-09-08 16:30:17 UTC,2019-09-08 16:30:17 UTC
722,Biological Science 252,2019-10-19 13:57:30 UTC,Necessitatibus neque velit. Quia et nemo. Et eveniet aut.,2019-09-08 16:30:17 UTC,2019-09-08 16:30:17 UTC
723,Health Science 114,2020-05-06 15:16:59 UTC,Sint necessitatibus eos. Labore ipsum rerum. Repudiandae quasi cupiditate.,2019-09-08 16:30:18 UTC,2019-09-08 16:30:18 UTC
724,Biomedical Science 540,2020-02-17 00:35:37 UTC,Sequi voluptatem aut. Ut aperiam odit. Molestiae rerum sint.,2019-09-08 16:30:18 UTC,2019-09-08 16:30:18 UTC
725,Computer Science 439,2020-03-09 06:34:20 UTC,Tenetur similique aspernatur. Cumque ullam voluptatibus. Omnis ea est.,2019-09-08 16:30:18 UTC,2019-09-08 16:30:18 UTC
726,Communications 153,2020-05-29 16:22:47 UTC,Libero dicta incidunt. Ea quia et. Ad voluptatem omnis.,2019-09-08 16:30:18 UTC,2019-09-08 16:30:18 UTC
727,Forensic Science 599,2020-02-01 05:55:37 UTC,Repudiandae dolor consequatur. Iste eaque et. Omnis expedita repudiandae.,2019-09-08 16:30:18 UTC,2019-09-08 16:30:18 UTC
728,Creative Arts 566,2020-03-16 10:27:29 UTC,Expedita quidem excepturi. Quo maxime quibusdam. Quo ipsa explicabo.,2019-09-08 16:30:18 UTC,2019-09-08 16:30:18 UTC
729,Nursing 554,2020-02-21 10:56:02 UTC,Nostrum sit nesciunt. Qui eum atque. Enim qui maiores.,2019-09-08 16:30:18 UTC,2019-09-08 16:30:18 UTC
730,Design 349,2019-12-22 14:15:42 UTC,Similique voluptate officia. Minima voluptates sint. Beatae est est.,2019-09-08 16:30:18 UTC,2019-09-08 16:30:18 UTC
731,Communications 483,2020-05-15 09:53:08 UTC,Occaecati eos quisquam. Est enim rem. Quia maxime odit.,2019-09-08 16:30:18 UTC,2019-09-08 16:30:18 UTC
732,Health Science 263,2020-02-20 13:57:49 UTC,Ducimus repellendus deserunt. Eius cupiditate autem. Beatae assumenda ipsam.,2019-09-08 16:30:18 UTC,2019-09-08 16:30:18 UTC
733,Biomedical Science 244,2020-04-13 23:05:16 UTC,Veritatis et molestiae. Omnis velit velit. Omnis temporibus eveniet.,2019-09-08 16:30:18 UTC,2019-09-08 16:30:18 UTC
734,Engineering 343,2019-12-13 08:33:41 UTC,At voluptatem molestiae. Placeat reiciendis in. Voluptatum amet et.,2019-09-08 16:30:18 UTC,2019-09-08 16:30:18 UTC
735,Business 545,2020-03-30 08:17:34 UTC,Quis cum impedit. Sint quibusdam quos. Et quidem cumque.,2019-09-08 16:30:18 UTC,2019-09-08 16:30:18 UTC
736,Communications 560,2019-11-10 20:03:54 UTC,Voluptatibus ea in. Optio atque et. Ea facilis soluta.,2019-09-08 16:30:18 UTC,2019-09-08 16:30:18 UTC
737,Criminology 396,2020-04-07 11:50:10 UTC,Reiciendis autem impedit. Quis at voluptate. Expedita aut repellendus.,2019-09-08 16:30:18 UTC,2019-09-08 16:30:18 UTC
738,Health Science 316,2020-01-23 03:53:07 UTC,Et neque omnis. Aspernatur incidunt possimus. Et deserunt laudantium.,2019-09-08 16:30:18 UTC,2019-09-08 16:30:18 UTC
739,Health Science 218,2020-04-15 04:44:07 UTC,Non perferendis et. Sed quia perspiciatis. Sit rerum suscipit.,2019-09-08 16:30:18 UTC,2019-09-08 16:30:18 UTC
740,Criminology 193,2020-04-04 14:42:49 UTC,Quaerat veniam officia. Ut distinctio ea. Facilis quo dignissimos.,2019-09-08 16:30:18 UTC,2019-09-08 16:30:18 UTC
741,Engineering 174,2019-11-03 16:06:34 UTC,Sit voluptatem laboriosam. Et qui quis. Iste ipsam quisquam.,2019-09-08 16:30:18 UTC,2019-09-08 16:30:18 UTC
742,Computer Science 282,2019-11-09 22:40:19 UTC,Fuga quia eos. Eius et modi. Qui nisi minima.,2019-09-08 16:30:18 UTC,2019-09-08 16:30:18 UTC
743,Psychology 598,2020-05-10 20:08:37 UTC,Rerum dolor aliquam. Officiis debitis nihil. Totam nam accusantium.,2019-09-08 16:30:18 UTC,2019-09-08 16:30:18 UTC
744,Business 217,2020-02-28 10:25:24 UTC,Rem rerum a. Eveniet quam eum. Hic sed omnis.,2019-09-08 16:30:18 UTC,2019-09-08 16:30:18 UTC
745,Communications 244,2020-05-28 05:53:17 UTC,Quam et omnis. Quo est architecto. Similique magnam explicabo.,2019-09-08 16:30:18 UTC,2019-09-08 16:30:18 UTC
746,Architectural Technology 564,2020-04-24 15:26:16 UTC,Illo odit soluta. Earum dolor sunt. Debitis quo totam.,2019-09-08 16:30:18 UTC,2019-09-08 16:30:18 UTC
747,Teaching 491,2020-01-25 11:37:50 UTC,Fugiat saepe voluptate. Qui facilis et. Eos quaerat fugiat.,2019-09-08 16:30:18 UTC,2019-09-08 16:30:18 UTC
748,Medicine 371,2020-01-31 11:52:34 UTC,Quia architecto dicta. Qui ut ipsam. Rem cupiditate voluptatem.,2019-09-08 16:30:18 UTC,2019-09-08 16:30:18 UTC
749,Medicine 283,2020-05-12 20:29:22 UTC,Explicabo magni et. Alias ipsa ut. Facere quidem aperiam.,2019-09-08 16:30:18 UTC,2019-09-08 16:30:18 UTC
750,Nursing 450,2020-02-20 06:33:53 UTC,Sequi iure itaque. Reiciendis corrupti provident. Et ipsum non.,2019-09-08 16:30:18 UTC,2019-09-08 16:30:18 UTC
751,Health Science 451,2020-02-04 06:48:01 UTC,Delectus fugiat illum. In asperiores voluptatem. Optio ex commodi.,2019-09-08 16:30:18 UTC,2019-09-08 16:30:18 UTC
752,Biological Science 573,2019-12-18 18:37:21 UTC,Alias exercitationem aut. Non omnis ipsam. Laboriosam eos et.,2019-09-08 16:30:18 UTC,2019-09-08 16:30:18 UTC
753,Medicine 432,2019-11-23 01:09:51 UTC,Sit et dolorem. In rerum sint. Fugiat hic quam.,2019-09-08 16:30:18 UTC,2019-09-08 16:30:18 UTC
754,Education 170,2020-03-06 23:34:34 UTC,Quia ea repudiandae. Qui et recusandae. Sunt ut voluptatibus.,2019-09-08 16:30:18 UTC,2019-09-08 16:30:18 UTC
755,Teaching 549,2019-12-16 04:11:40 UTC,Harum non itaque. Error aut et. Sint tempore deserunt.,2019-09-08 16:30:18 UTC,2019-09-08 16:30:18 UTC
756,Psychology 598,2020-01-19 14:00:56 UTC,Voluptatibus corrupti sapiente. Fugit quia dolore. Animi tenetur laudantium.,2019-09-08 16:30:18 UTC,2019-09-08 16:30:18 UTC
757,Computer Science 139,2020-02-15 07:53:24 UTC,Ut temporibus facilis. Repellendus non cupiditate. Ut non magnam.,2019-09-08 16:30:18 UTC,2019-09-08 16:30:18 UTC
758,Criminology 352,2020-03-19 06:28:46 UTC,Sapiente quis possimus. Voluptatibus ut sit. Id cum eaque.,2019-09-08 16:30:18 UTC,2019-09-08 16:30:18 UTC
759,Psychology 464,2019-10-12 18:18:47 UTC,Quae accusamus autem. Ipsum ratione repellendus. Laboriosam voluptatem temporibus.,2019-09-08 16:30:18 UTC,2019-09-08 16:30:18 UTC
760,Biological Science 193,2020-02-14 19:04:08 UTC,Corporis voluptatibus ea. A et quisquam. A nemo nihil.,2019-09-08 16:30:18 UTC,2019-09-08 16:30:18 UTC
761,Design 383,2020-07-08 00:08:41 UTC,Molestias facilis aut. Totam illo et. Voluptatem dolor aliquid.,2019-09-08 16:30:18 UTC,2019-09-08 16:30:18 UTC
762,Computer Science 347,2020-04-11 23:48:34 UTC,Sint assumenda quibusdam. Sunt dolorem ut. Ea magnam et.,2019-09-08 16:30:18 UTC,2019-09-08 16:30:18 UTC
763,Business 290,2019-12-10 01:03:52 UTC,Ut et libero. Ipsa recusandae quia. Porro ut minima.,2019-09-08 16:30:18 UTC,2019-09-08 16:30:18 UTC
764,Education 194,2020-01-09 19:43:51 UTC,Sequi est molestiae. Commodi dolor laborum. Aut iste sit.,2019-09-08 16:30:18 UTC,2019-09-08 16:30:18 UTC
765,Creative Arts 148,2020-07-01 10:49:59 UTC,Vel quia sint. Et neque doloribus. Ut quo et.,2019-09-08 16:30:18 UTC,2019-09-08 16:30:18 UTC
766,Engineering 122,2020-05-20 05:00:47 UTC,Voluptatem reprehenderit sunt. Ad quo qui. Dolore accusamus et.,2019-09-08 16:30:18 UTC,2019-09-08 16:30:18 UTC
767,Information Systems 241,2020-02-20 05:18:29 UTC,Et quisquam pariatur. Sint sit et. Odit saepe optio.,2019-09-08 16:30:18 UTC,2019-09-08 16:30:18 UTC
768,Biological Science 491,2020-06-25 01:32:48 UTC,Assumenda hic est. Autem numquam nihil. Aut ratione dolorum.,2019-09-08 16:30:18 UTC,2019-09-08 16:30:18 UTC
769,Business 330,2020-05-29 19:33:54 UTC,Quibusdam sint dicta. Cupiditate tenetur enim. Voluptatem et aspernatur.,2019-09-08 16:30:18 UTC,2019-09-08 16:30:18 UTC
770,Engineering 212,2019-10-28 23:53:28 UTC,Autem maiores distinctio. Quisquam qui asperiores. Ducimus sint architecto.,2019-09-08 16:30:19 UTC,2019-09-08 16:30:19 UTC
771,Psychology 460,2020-01-24 14:57:51 UTC,Excepturi reprehenderit quo. Qui consequatur unde. Ab error itaque.,2019-09-08 16:30:19 UTC,2019-09-08 16:30:19 UTC
772,Engineering 587,2019-10-10 05:09:42 UTC,Voluptatem consectetur eum. Id sint laudantium. Provident alias eum.,2019-09-08 16:30:19 UTC,2019-09-08 16:30:19 UTC
773,Creative Arts 448,2019-12-18 12:14:54 UTC,Quos dolorum esse. Vitae earum autem. Minus minima blanditiis.,2019-09-08 16:30:19 UTC,2019-09-08 16:30:19 UTC
774,Business 276,2020-03-06 15:59:33 UTC,Et voluptas nihil. Voluptas tempora quia. Aut et nulla.,2019-09-08 16:30:19 UTC,2019-09-08 16:30:19 UTC
775,Information Systems 259,2019-10-09 12:26:14 UTC,Quia neque ea. Et omnis hic. Laborum assumenda aliquid.,2019-09-08 16:30:19 UTC,2019-09-08 16:30:19 UTC
776,Health Science 462,2020-04-25 16:33:26 UTC,Corporis quia quidem. Dolores sapiente nam. Non cumque assumenda.,2019-09-08 16:30:19 UTC,2019-09-08 16:30:19 UTC
777,Nursing 484,2020-05-02 19:57:57 UTC,Quibusdam magnam fugiat. Ratione consequatur animi. Doloremque et unde.,2019-09-08 16:30:19 UTC,2019-09-08 16:30:19 UTC
778,Creative Arts 338,2020-03-14 12:53:27 UTC,Officia et vero. Et omnis cupiditate. Veniam accusantium excepturi.,2019-09-08 16:30:19 UTC,2019-09-08 16:30:19 UTC
779,Education 371,2020-03-10 18:56:13 UTC,Velit repellat nulla. Id totam minus. Quo ipsum sed.,2019-09-08 16:30:19 UTC,2019-09-08 16:30:19 UTC
780,Communications 231,2020-05-07 02:38:37 UTC,Illum aliquam repellendus. Ut quo labore. Porro doloremque voluptatem.,2019-09-08 16:30:19 UTC,2019-09-08 16:30:19 UTC
781,Arts 180,2020-01-17 07:05:34 UTC,Voluptatem quasi vel. Accusamus ab libero. Quam suscipit natus.,2019-09-08 16:30:19 UTC,2019-09-08 16:30:19 UTC
782,Biological Science 412,2020-05-10 18:00:45 UTC,Sit enim deleniti. Excepturi incidunt eveniet. Doloremque sint rerum.,2019-09-08 16:30:19 UTC,2019-09-08 16:30:19 UTC
783,Forensic Science 170,2020-06-22 06:19:12 UTC,Dignissimos corporis dolorem. Nihil quia enim. Eos et eligendi.,2019-09-08 16:30:19 UTC,2019-09-08 16:30:19 UTC
784,Teaching 347,2020-06-13 03:21:15 UTC,Aperiam velit ratione. Et ipsam ea. Minus ut vel.,2019-09-08 16:30:19 UTC,2019-09-08 16:30:19 UTC
785,Arts 472,2020-06-02 19:00:27 UTC,Sint cupiditate dicta. Sequi ut minus. Et in ratione.,2019-09-08 16:30:19 UTC,2019-09-08 16:30:19 UTC
786,Health Science 227,2020-07-03 19:45:44 UTC,Consequatur omnis sunt. Aut consequuntur molestiae. Est autem voluptatem.,2019-09-08 16:30:19 UTC,2019-09-08 16:30:19 UTC
787,Communications 415,2019-11-27 15:58:06 UTC,Quia molestias aut. Id hic non. Neque quaerat voluptatem.,2019-09-08 16:30:19 UTC,2019-09-08 16:30:19 UTC
788,Health Science 159,2020-01-17 15:11:40 UTC,Et dignissimos eum. Blanditiis et laudantium. Sint veniam sit.,2019-09-08 16:30:19 UTC,2019-09-08 16:30:19 UTC
789,Education 268,2019-10-27 12:24:21 UTC,Dolores amet voluptatibus. Eaque dolores sint. Quisquam qui aliquid.,2019-09-08 16:30:19 UTC,2019-09-08 16:30:19 UTC
790,Criminology 110,2020-02-22 02:26:27 UTC,Fugit voluptates officia. Ut sit qui. Quaerat rerum impedit.,2019-09-08 16:30:19 UTC,2019-09-08 16:30:19 UTC
791,Architectural Technology 450,2019-11-29 18:07:07 UTC,Amet harum aut. Sunt ut voluptatem. Labore aliquam iusto.,2019-09-08 16:30:19 UTC,2019-09-08 16:30:19 UTC
792,Psychology 439,2020-02-19 07:50:39 UTC,Doloribus velit rerum. Ratione laudantium impedit. Voluptatem qui ut.,2019-09-08 16:30:19 UTC,2019-09-08 16:30:19 UTC
793,Law 255,2019-10-20 05:12:32 UTC,Eaque voluptatibus inventore. Velit officiis et. Sed rem ea.,2019-09-08 16:30:19 UTC,2019-09-08 16:30:19 UTC
794,Computer Science 223,2020-02-26 17:12:50 UTC,Accusamus nihil consequatur. Ab sint natus. Numquam consectetur praesentium.,2019-09-08 16:30:19 UTC,2019-09-08 16:30:19 UTC
795,Creative Arts 360,2020-04-01 07:32:36 UTC,Fuga officiis est. Nam soluta perferendis. Voluptatem ipsum porro.,2019-09-08 16:30:19 UTC,2019-09-08 16:30:19 UTC
796,Medicine 350,2019-10-21 15:32:49 UTC,Occaecati et consectetur. Quos repellendus occaecati. Iure iusto in.,2019-09-08 16:30:19 UTC,2019-09-08 16:30:19 UTC
797,Computer Science 555,2019-10-23 16:08:40 UTC,Incidunt qui delectus. Aut ut dolores. Et eum dolorem.,2019-09-08 16:30:19 UTC,2019-09-08 16:30:19 UTC
798,Communications 548,2020-01-05 13:58:31 UTC,Possimus doloremque reprehenderit. Est sit voluptatem. Quis voluptatum consequatur.,2019-09-08 16:30:19 UTC,2019-09-08 16:30:19 UTC
799,Engineering 170,2020-03-02 09:24:26 UTC,Blanditiis voluptatem accusantium. Ullam hic voluptas. Vel ipsum ad.,2019-09-08 16:30:19 UTC,2019-09-08 16:30:19 UTC
800,Criminology 513,2019-10-30 06:09:49 UTC,Soluta temporibus libero. Consequatur voluptatibus praesentium. Labore qui ut.,2019-09-08 16:30:19 UTC,2019-09-08 16:30:19 UTC
801,Biomedical Science 129,2020-01-20 10:07:00 UTC,Tempora ut illo. Aperiam vero exercitationem. Autem aut praesentium.,2019-09-08 16:30:19 UTC,2019-09-08 16:30:19 UTC
802,Teaching 562,2020-05-15 16:04:14 UTC,Earum cum iure. Doloremque esse in. Autem porro ea.,2019-09-08 16:30:19 UTC,2019-09-08 16:30:19 UTC
803,Commerce 138,2019-12-23 19:38:21 UTC,Animi facere id. Et veniam unde. Quia reiciendis et.,2019-09-08 16:30:19 UTC,2019-09-08 16:30:19 UTC
804,Arts 340,2019-11-11 16:18:50 UTC,Et aperiam recusandae. Aut et ipsum. Dolor ut ut.,2019-09-08 16:30:19 UTC,2019-09-08 16:30:19 UTC
805,Biological Science 418,2020-04-12 10:27:04 UTC,Suscipit doloremque soluta. Dolorem rem ut. Modi consequatur iure.,2019-09-08 16:30:19 UTC,2019-09-08 16:30:19 UTC
806,Psychology 240,2019-12-20 06:03:54 UTC,Non voluptatem eos. Magni non error. Nihil quis rerum.,2019-09-08 16:30:20 UTC,2019-09-08 16:30:20 UTC
807,Engineering 211,2019-10-12 10:32:22 UTC,Nostrum est omnis. Ex consequuntur exercitationem. Maiores doloribus placeat.,2019-09-08 16:30:20 UTC,2019-09-08 16:30:20 UTC
808,Engineering 185,2020-02-13 15:53:24 UTC,Qui dolor molestias. Enim qui officia. Corrupti nulla quasi.,2019-09-08 16:30:20 UTC,2019-09-08 16:30:20 UTC
809,Creative Arts 590,2020-05-09 08:38:30 UTC,Qui ea aut. Possimus omnis odio. Quis eos amet.,2019-09-08 16:30:20 UTC,2019-09-08 16:30:20 UTC
810,Criminology 145,2020-05-15 23:30:29 UTC,Saepe iste quaerat. Nulla nostrum dolores. Sapiente et in.,2019-09-08 16:30:20 UTC,2019-09-08 16:30:20 UTC
811,Information Systems 161,2020-04-27 14:37:52 UTC,Maiores quo facere. Ut aut culpa. Quia recusandae enim.,2019-09-08 16:30:20 UTC,2019-09-08 16:30:20 UTC
812,Computer Science 545,2020-06-15 22:52:24 UTC,Adipisci quia et. Eum repudiandae facere. Unde ab ut.,2019-09-08 16:30:20 UTC,2019-09-08 16:30:20 UTC
813,Health Science 590,2020-06-14 06:00:16 UTC,Qui dignissimos culpa. Vero fuga odit. Rerum aut et.,2019-09-08 16:30:20 UTC,2019-09-08 16:30:20 UTC
814,Forensic Science 127,2020-04-20 12:44:09 UTC,Eum rerum sed. Perspiciatis a fugit. Molestias ipsa sapiente.,2019-09-08 16:30:20 UTC,2019-09-08 16:30:20 UTC
815,Biomedical Science 260,2020-04-21 02:31:59 UTC,Sit alias non. Libero totam tempora. Consequatur nobis laboriosam.,2019-09-08 16:30:20 UTC,2019-09-08 16:30:20 UTC
816,Information Systems 298,2020-04-14 15:38:41 UTC,Non sint doloremque. Id sequi exercitationem. Explicabo ullam illum.,2019-09-08 16:30:20 UTC,2019-09-08 16:30:20 UTC
817,Creative Arts 525,2019-12-30 19:21:24 UTC,Soluta praesentium aut. Necessitatibus quae sed. Voluptas asperiores non.,2019-09-08 16:30:20 UTC,2019-09-08 16:30:20 UTC
818,Nursing 177,2020-01-11 17:04:31 UTC,Impedit ex maxime. Dolorem nemo explicabo. Necessitatibus praesentium ab.,2019-09-08 16:30:20 UTC,2019-09-08 16:30:20 UTC
819,Education 599,2019-10-26 07:31:59 UTC,Qui tenetur quasi. Ipsam distinctio sunt. Necessitatibus perspiciatis facere.,2019-09-08 16:30:20 UTC,2019-09-08 16:30:20 UTC
820,Arts 290,2019-12-09 21:21:41 UTC,Amet quis debitis. Ab qui perferendis. Natus error quidem.,2019-09-08 16:30:20 UTC,2019-09-08 16:30:20 UTC
821,Engineering 547,2020-06-03 05:14:57 UTC,In velit dolor. Veniam eveniet ratione. Id ipsam et.,2019-09-08 16:30:20 UTC,2019-09-08 16:30:20 UTC
822,Health Science 235,2020-01-08 15:28:14 UTC,Perspiciatis dignissimos corporis. Ut corrupti dolorem. Cum possimus modi.,2019-09-08 16:30:20 UTC,2019-09-08 16:30:20 UTC
823,Law 355,2019-12-13 14:23:58 UTC,Ducimus nobis dolor. Dolorem velit adipisci. Sed iusto soluta.,2019-09-08 16:30:20 UTC,2019-09-08 16:30:20 UTC
824,Architectural Technology 162,2020-05-23 21:21:01 UTC,Expedita placeat cumque. Nihil fuga veniam. Quas qui voluptatem.,2019-09-08 16:30:20 UTC,2019-09-08 16:30:20 UTC
825,Medicine 341,2020-06-06 17:15:00 UTC,Omnis omnis ea. Quia explicabo in. Repellat itaque dolor.,2019-09-08 16:30:20 UTC,2019-09-08 16:30:20 UTC
826,Information Systems 546,2019-11-09 18:49:27 UTC,Repellat similique qui. Fugiat libero itaque. In qui molestiae.,2019-09-08 16:30:20 UTC,2019-09-08 16:30:20 UTC
827,Engineering 284,2019-12-20 20:00:35 UTC,Odio omnis quia. Rem qui eius. Quidem asperiores sit.,2019-09-08 16:30:20 UTC,2019-09-08 16:30:20 UTC
