id,title,due_date,description,created_at,updated_at
496,Communications 517,2019-10-15 22:11:51 UTC,Qui nihil voluptatum. Quam dolor voluptatem. Aut molestiae quo.,2019-09-08 16:30:14 UTC,2019-09-08 16:30:14 UTC
497,Law 389,2020-06-08 13:58:31 UTC,Ullam similique aut. Voluptatem aliquid et. Adipisci atque cumque.,2019-09-08 16:30:14 UTC,2019-09-08 16:30:14 UTC
498,Architectural Technology 320,2020-01-18 13:14:03 UTC,Quas iure consequatur. Quia iure quaerat. Placeat quidem corrupti.,2019-09-08 16:30:14 UTC,2019-09-08 16:30:14 UTC
499,Biological Science 113,2020-03-29 08:34:00 UTC,Itaque provident quia. Reiciendis sit autem. Ipsam aspernatur neque.,2019-09-08 16:30:14 UTC,2019-09-08 16:30:14 UTC
500,Business 384,2020-03-22 19:44:36 UTC,Molestiae dolorem quaerat. Neque id sit. Amet quas dolorem.,2019-09-08 16:30:14 UTC,2019-09-08 16:30:14 UTC
501,Psychology 110,2020-02-27 16:59:38 UTC,Est non officiis. Odio unde quasi. Fuga consequatur nihil.,2019-09-08 16:30:14 UTC,2019-09-08 16:30:14 UTC
502,Arts 263,2020-02-15 17:56:35 UTC,Voluptas voluptatum illum. Repudiandae impedit doloribus. Nemo eaque ipsum.,2019-09-08 16:30:14 UTC,2019-09-08 16:30:14 UTC
503,Nursing 464,2019-11-03 21:21:41 UTC,Placeat voluptas corrupti. Impedit id est. Qui minus quisquam.,2019-09-08 16:30:14 UTC,2019-09-08 16:30:14 UTC
504,Biological Science 588,2019-12-03 12:13:55 UTC,Suscipit corrupti dolore. Et et voluptatum. Et rerum labore.,2019-09-08 16:30:14 UTC,2019-09-08 16:30:14 UTC
505,Education 420,2020-04-16 15:14:45 UTC,Velit dignissimos excepturi. Quam consequuntur enim. Voluptatem magni in.,2019-09-08 16:30:14 UTC,2019-09-08 16:30:14 UTC
506,Computer Science 490,2019-12-10 00:01:52 UTC,Officiis totam ipsam. Vel voluptates quia. Numquam ab doloremque.,2019-09-08 16:30:14 UTC,2019-09-08 16:30:14 UTC
507,Commerce 159,2020-06-21 03:01:35 UTC,Doloremque quidem magni. Esse quas cupiditate. Omnis sed sunt.,2019-09-08 16:30:14 UTC,2019-09-08 16:30:14 UTC
508,Nursing 590,2020-07-03 15:21:23 UTC,Sint similique nam. Quibusdam adipisci labore. Tempora et debitis.,2019-09-08 16:30:14 UTC,2019-09-08 16:30:14 UTC
509,Communications 168,2020-03-25 09:45:11 UTC,Repellat nostrum et. Quis numquam et. Voluptatem laborum perspiciatis.,2019-09-08 16:30:14 UTC,2019-09-08 16:30:14 UTC
510,Education 551,2020-05-21 08:28:26 UTC,Necessitatibus ducimus amet. Sit dolor velit. Delectus at nihil.,2019-09-08 16:30:14 UTC,2019-09-08 16:30:14 UTC
511,Information Systems 295,2020-05-05 10:19:51 UTC,Totam vel maiores. Qui quia quibusdam. Illum temporibus necessitatibus.,2019-09-08 16:30:15 UTC,2019-09-08 16:30:15 UTC
512,Biological Science 548,2020-01-03 08:39:29 UTC,Dolores explicabo vel. Voluptatum ab eum. Consequatur dolorem ratione.,2019-09-08 16:30:15 UTC,2019-09-08 16:30:15 UTC
513,Psychology 153,2020-07-02 13:35:27 UTC,Pariatur asperiores quo. Rerum totam ut. Unde consectetur et.,2019-09-08 16:30:15 UTC,2019-09-08 16:30:15 UTC
514,Education 166,2020-03-30 14:24:42 UTC,Neque recusandae vel. Dolores asperiores commodi. Voluptatem cumque provident.,2019-09-08 16:30:15 UTC,2019-09-08 16:30:15 UTC
515,Applied Science (Psychology) 280,2019-11-12 07:23:19 UTC,Inventore ut dicta. Molestiae in sed. Dolore explicabo quis.,2019-09-08 16:30:15 UTC,2019-09-08 16:30:15 UTC
516,Computer Science 298,2020-02-06 05:36:14 UTC,Ut qui dolor. Magnam suscipit sed. Aperiam impedit ipsam.,2019-09-08 16:30:15 UTC,2019-09-08 16:30:15 UTC
517,Forensic Science 476,2020-05-15 08:27:20 UTC,Laborum nisi dolores. Ut facere facilis. Et consequatur quas.,2019-09-08 16:30:15 UTC,2019-09-08 16:30:15 UTC
518,Forensic Science 216,2020-06-06 05:13:00 UTC,Necessitatibus odit animi. Modi cupiditate ipsam. Esse hic ea.,2019-09-08 16:30:15 UTC,2019-09-08 16:30:15 UTC
519,Design 145,2020-06-05 22:06:48 UTC,Quo vero illum. Quaerat nam velit. Quae ut vero.,2019-09-08 16:30:15 UTC,2019-09-08 16:30:15 UTC
520,Forensic Science 525,2020-04-24 13:05:23 UTC,Voluptas magni similique. Quod ea qui. Enim dicta qui.,2019-09-08 16:30:15 UTC,2019-09-08 16:30:15 UTC
521,Architectural Technology 191,2020-03-05 05:58:32 UTC,Sequi explicabo facere. Eaque eligendi asperiores. In omnis rerum.,2019-09-08 16:30:15 UTC,2019-09-08 16:30:15 UTC
522,Biological Science 172,2020-06-02 18:03:48 UTC,Quisquam reiciendis nam. Non hic officiis. Tenetur nisi est.,2019-09-08 16:30:15 UTC,2019-09-08 16:30:15 UTC
523,Arts 462,2019-11-13 05:21:09 UTC,Vitae minima reiciendis. Aut ullam est. Est sunt consequuntur.,2019-09-08 16:30:15 UTC,2019-09-08 16:30:15 UTC
524,Criminology 598,2020-02-12 19:00:14 UTC,Et ducimus laudantium. Enim excepturi enim. Et voluptas et.,2019-09-08 16:30:15 UTC,2019-09-08 16:30:15 UTC
525,Teaching 254,2020-01-17 04:10:25 UTC,Ea doloribus quo. Sint doloribus maiores. Eveniet qui quam.,2019-09-08 16:30:15 UTC,2019-09-08 16:30:15 UTC
526,Law 275,2019-10-27 07:21:15 UTC,Quia quia ipsam. Molestiae itaque aperiam. Quos nesciunt aperiam.,2019-09-08 16:30:15 UTC,2019-09-08 16:30:15 UTC
527,Health Science 428,2020-02-08 04:24:51 UTC,Odio aut dignissimos. Fugit sed ducimus. Esse velit aut.,2019-09-08 16:30:15 UTC,2019-09-08 16:30:15 UTC
528,Forensic Science 475,2020-07-03 23:00:33 UTC,Doloremque ipsum vitae. Architecto cupiditate itaque. Optio officiis quasi.,2019-09-08 16:30:15 UTC,2019-09-08 16:30:15 UTC
529,Education 421,2020-04-20 03:53:06 UTC,Placeat in et. Dolores recusandae quasi. Nam repellendus et.,2019-09-08 16:30:15 UTC,2019-09-08 16:30:15 UTC
530,Medicine 160,2020-03-31 20:46:36 UTC,Vel enim qui. Voluptate harum aut. Numquam ea ea.,2019-09-08 16:30:15 UTC,2019-09-08 16:30:15 UTC
531,Commerce 531,2019-12-27 07:17:49 UTC,Facere adipisci voluptas. Enim dolores et. Consequuntur exercitationem perferendis.,2019-09-08 16:30:15 UTC,2019-09-08 16:30:15 UTC
532,Computer Science 563,2020-02-22 00:22:23 UTC,Aut quibusdam est. Non vel eveniet. Saepe autem molestiae.,2019-09-08 16:30:15 UTC,2019-09-08 16:30:15 UTC
533,Health Science 314,2020-06-15 06:02:56 UTC,Sed autem sunt. Quia rem et. Fuga vitae eos.,2019-09-08 16:30:15 UTC,2019-09-08 16:30:15 UTC
534,Information Systems 224,2020-05-11 19:42:28 UTC,Quidem hic corrupti. Voluptate deleniti ipsa. Quia laboriosam quae.,2019-09-08 16:30:15 UTC,2019-09-08 16:30:15 UTC
535,Commerce 366,2020-05-21 06:12:12 UTC,Quaerat nihil voluptatibus. At dolorum cum. Ratione incidunt quaerat.,2019-09-08 16:30:15 UTC,2019-09-08 16:30:15 UTC
536,Psychology 511,2020-07-02 01:47:13 UTC,Voluptatem possimus mollitia. Id aliquid et. Repellendus sit esse.,2019-09-08 16:30:15 UTC,2019-09-08 16:30:15 UTC
537,Forensic Science 586,2020-04-22 03:53:02 UTC,Eum saepe adipisci. Quia illum autem. Voluptatem et maiores.,2019-09-08 16:30:15 UTC,2019-09-08 16:30:15 UTC
538,Communications 384,2020-06-27 04:00:06 UTC,Labore atque ipsam. Molestiae ut quia. Blanditiis saepe vel.,2019-09-08 16:30:15 UTC,2019-09-08 16:30:15 UTC
539,Education 121,2019-12-23 04:34:09 UTC,Optio quos nihil. Consequatur impedit voluptas. Ad quo aut.,2019-09-08 16:30:15 UTC,2019-09-08 16:30:15 UTC
540,Education 169,2020-05-04 10:58:07 UTC,Debitis et aut. Nam non mollitia. Assumenda est ut.,2019-09-08 16:30:15 UTC,2019-09-08 16:30:15 UTC
541,Architectural Technology 369,2020-01-02 22:05:39 UTC,Amet ab similique. Non eligendi consectetur. Autem est id.,2019-09-08 16:30:15 UTC,2019-09-08 16:30:15 UTC
542,Business 377,2020-04-16 08:37:21 UTC,Nesciunt ipsam eveniet. Et omnis doloremque. Voluptate numquam ex.,2019-09-08 16:30:15 UTC,2019-09-08 16:30:15 UTC
543,Computer Science 396,2020-05-13 20:06:04 UTC,Ex quis ullam. Sint nisi non. Et non magnam.,2019-09-08 16:30:15 UTC,2019-09-08 16:30:15 UTC
544,Communications 569,2020-06-26 02:17:49 UTC,Earum consequatur cupiditate. Similique facere optio. Dignissimos exercitationem sit.,2019-09-08 16:30:15 UTC,2019-09-08 16:30:15 UTC
545,Commerce 192,2020-06-06 22:41:08 UTC,Maxime nihil et. Dolorem quis vero. Sit odio quae.,2019-09-08 16:30:15 UTC,2019-09-08 16:30:15 UTC
546,Creative Arts 471,2020-03-30 11:45:07 UTC,Dolore est tenetur. Vero facere enim. Nisi enim dolorum.,2019-09-08 16:30:15 UTC,2019-09-08 16:30:15 UTC
547,Applied Science (Psychology) 418,2020-01-14 21:07:03 UTC,Repudiandae temporibus voluptatem. Vero quidem dolorum. Fugit consequatur fuga.,2019-09-08 16:30:15 UTC,2019-09-08 16:30:15 UTC
548,Communications 192,2020-04-06 05:59:45 UTC,Impedit rem ut. Rerum placeat ut. Necessitatibus natus illo.,2019-09-08 16:30:15 UTC,2019-09-08 16:30:15 UTC
549,Health Science 520,2020-01-02 03:33:38 UTC,Ipsam alias rerum. Itaque sint hic. Iste est qui.,2019-09-08 16:30:15 UTC,2019-09-08 16:30:15 UTC
551,Nursing 471,2020-03-22 07:19:51 UTC,Laborum tempore qui. Dicta dolorem est. Reprehenderit animi aspernatur.,2019-09-08 16:30:15 UTC,2019-09-08 16:30:15 UTC
552,Arts 274,2020-03-21 04:43:10 UTC,Libero quod et. Est vel fuga. Eaque culpa id.,2019-09-08 16:30:15 UTC,2019-09-08 16:30:15 UTC
553,Forensic Science 436,2020-03-06 13:25:12 UTC,Est occaecati qui. Quasi est cum. Vitae sunt necessitatibus.,2019-09-08 16:30:15 UTC,2019-09-08 16:30:15 UTC
554,Commerce 142,2019-11-03 23:59:12 UTC,Laboriosam dolore ab. Repellendus suscipit ut. Occaecati qui architecto.,2019-09-08 16:30:15 UTC,2019-09-08 16:30:15 UTC
555,Teaching 382,2020-03-17 10:34:14 UTC,Nobis sint veniam. Ut et ex. Nemo laborum repudiandae.,2019-09-08 16:30:15 UTC,2019-09-08 16:30:15 UTC
556,Engineering 567,2019-12-23 13:01:11 UTC,Nostrum quo dolorum. Perferendis sit itaque. Quam error veritatis.,2019-09-08 16:30:15 UTC,2019-09-08 16:30:15 UTC
557,Applied Science (Psychology) 241,2020-03-20 22:58:12 UTC,In saepe voluptatem. Natus expedita illo. Repellat animi vitae.,2019-09-08 16:30:15 UTC,2019-09-08 16:30:15 UTC
558,Engineering 453,2020-07-07 17:53:22 UTC,Rerum velit optio. Quibusdam quae aut. Et reiciendis aut.,2019-09-08 16:30:15 UTC,2019-09-08 16:30:15 UTC
559,Nursing 110,2020-06-16 01:52:36 UTC,Inventore consequatur accusantium. Laboriosam at quis. Temporibus est sequi.,2019-09-08 16:30:15 UTC,2019-09-08 16:30:15 UTC
560,Nursing 451,2020-07-03 02:53:38 UTC,Rerum placeat natus. Nam molestias nostrum. Molestiae nam officiis.,2019-09-08 16:30:15 UTC,2019-09-08 16:30:15 UTC
561,Forensic Science 442,2020-03-29 19:47:46 UTC,Fuga qui est. Qui et est. Repellat occaecati quia.,2019-09-08 16:30:15 UTC,2019-09-08 16:30:15 UTC
562,Commerce 279,2020-03-02 20:11:12 UTC,Repellat nemo et. Dolores temporibus corporis. Est voluptatem earum.,2019-09-08 16:30:15 UTC,2019-09-08 16:30:15 UTC
563,Health Science 562,2020-03-12 04:22:00 UTC,Consequatur deserunt temporibus. Quia officia non. Reprehenderit voluptates laudantium.,2019-09-08 16:30:15 UTC,2019-09-08 16:30:15 UTC
564,Creative Arts 273,2019-11-09 05:02:51 UTC,Voluptatem voluptas eos. Iste hic voluptatum. Magni voluptatem ut.,2019-09-08 16:30:15 UTC,2019-09-08 16:30:15 UTC
565,Law 495,2020-07-03 11:06:32 UTC,Doloribus excepturi vero. Dolor omnis asperiores. Alias voluptas a.,2019-09-08 16:30:15 UTC,2019-09-08 16:30:15 UTC
566,Psychology 360,2020-03-17 03:32:16 UTC,Laborum mollitia distinctio. Consequatur non officiis. Dolorem modi sit.,2019-09-08 16:30:15 UTC,2019-09-08 16:30:15 UTC
567,Engineering 266,2019-12-05 22:14:30 UTC,Consequatur reprehenderit nobis. Consequuntur ut labore. Soluta labore qui.,2019-09-08 16:30:15 UTC,2019-09-08 16:30:15 UTC
568,Psychology 222,2020-06-10 23:35:38 UTC,Nesciunt perferendis non. Tenetur sit rerum. Aut magnam ea.,2019-09-08 16:30:15 UTC,2019-09-08 16:30:15 UTC
569,Design 260,2019-12-14 09:34:30 UTC,Consectetur cumque a. Fugit voluptate ipsam. Et laudantium sint.,2019-09-08 16:30:15 UTC,2019-09-08 16:30:15 UTC
570,Design 462,2019-11-20 09:58:12 UTC,Aperiam non similique. Repellendus voluptas repellat. Et ut deserunt.,2019-09-08 16:30:15 UTC,2019-09-08 16:30:15 UTC
571,Arts 270,2019-12-05 09:08:48 UTC,Tempora dolor cumque. Aliquam fuga perferendis. Facilis non soluta.,2019-09-08 16:30:15 UTC,2019-09-08 16:30:15 UTC
572,Engineering 597,2020-01-06 13:08:20 UTC,Et et facilis. Magnam accusamus nesciunt. Incidunt corporis impedit.,2019-09-08 16:30:15 UTC,2019-09-08 16:30:15 UTC
573,Design 383,2019-12-31 04:09:05 UTC,Accusamus alias qui. Possimus hic dicta. Ut at iste.,2019-09-08 16:30:15 UTC,2019-09-08 16:30:15 UTC
574,Commerce 313,2019-11-26 02:30:43 UTC,Nobis harum amet. Libero esse qui. Modi similique harum.,2019-09-08 16:30:15 UTC,2019-09-08 16:30:15 UTC
575,Nursing 140,2020-01-13 04:05:08 UTC,Ut nam et. Occaecati beatae consequatur. Sit saepe a.,2019-09-08 16:30:15 UTC,2019-09-08 16:30:15 UTC
576,Business 266,2019-11-13 09:56:30 UTC,Beatae laborum at. Consequatur provident aperiam. Quia expedita corporis.,2019-09-08 16:30:15 UTC,2019-09-08 16:30:15 UTC
577,Applied Science (Psychology) 250,2020-05-22 06:14:25 UTC,Repudiandae et nam. Aut ex et. Natus autem delectus.,2019-09-08 16:30:15 UTC,2019-09-08 16:30:15 UTC
578,Medicine 385,2019-12-19 08:01:30 UTC,Qui eos velit. Incidunt nesciunt iusto. Officiis sit culpa.,2019-09-08 16:30:15 UTC,2019-09-08 16:30:15 UTC
579,Computer Science 189,2020-03-29 02:47:52 UTC,Dolores quis quaerat. Nihil et autem. Soluta in qui.,2019-09-08 16:30:15 UTC,2019-09-08 16:30:15 UTC
580,Design 254,2020-06-29 14:11:22 UTC,Quasi nulla doloremque. Tenetur unde consectetur. Eligendi sit eius.,2019-09-08 16:30:15 UTC,2019-09-08 16:30:15 UTC
581,Creative Arts 567,2020-02-18 11:40:52 UTC,Aliquid dolorem est. Ipsam rem at. Et totam occaecati.,2019-09-08 16:30:15 UTC,2019-09-08 16:30:15 UTC
582,Commerce 591,2020-04-29 22:56:11 UTC,Aut odit voluptatem. Aut ut aliquid. Corrupti sunt facilis.,2019-09-08 16:30:15 UTC,2019-09-08 16:30:15 UTC
583,Criminology 447,2020-04-10 01:53:48 UTC,Iusto optio rerum. Consequatur nesciunt autem. Officiis aut architecto.,2019-09-08 16:30:15 UTC,2019-09-08 16:30:15 UTC
584,Education 595,2020-04-18 21:19:27 UTC,Et autem magnam. Voluptatibus quae soluta. Modi voluptatem et.,2019-09-08 16:30:15 UTC,2019-09-08 16:30:15 UTC
585,Commerce 429,2020-01-14 21:19:25 UTC,Eos nisi iusto. Ea officiis vero. Est consequuntur rerum.,2019-09-08 16:30:15 UTC,2019-09-08 16:30:15 UTC
586,Arts 166,2020-06-07 23:27:14 UTC,Ut cupiditate voluptates. Aut maxime nemo. Ad doloremque et.,2019-09-08 16:30:15 UTC,2019-09-08 16:30:15 UTC
587,Information Systems 242,2019-12-11 01:10:33 UTC,Ipsam ut accusantium. Velit debitis corporis. Asperiores nihil dignissimos.,2019-09-08 16:30:15 UTC,2019-09-08 16:30:15 UTC
588,Information Systems 231,2020-05-29 22:18:43 UTC,Quaerat debitis voluptate. Et maxime aut. Atque consequatur minima.,2019-09-08 16:30:15 UTC,2019-09-08 16:30:15 UTC
589,Arts 528,2020-02-20 18:31:06 UTC,Dignissimos et corrupti. Qui odio fuga. Eligendi minus consequatur.,2019-09-08 16:30:15 UTC,2019-09-08 16:30:15 UTC
590,Arts 214,2020-03-24 00:10:59 UTC,Incidunt et nisi. Corporis accusantium maiores. Consequatur eum error.,2019-09-08 16:30:15 UTC,2019-09-08 16:30:15 UTC
591,Law 399,2019-12-20 06:16:01 UTC,Ut ex harum. Qui magnam pariatur. Et aspernatur dolor.,2019-09-08 16:30:15 UTC,2019-09-08 16:30:15 UTC
592,Nursing 375,2020-06-30 03:33:42 UTC,Tempora consequuntur optio. Sed rem explicabo. Aliquam nisi quasi.,2019-09-08 16:30:15 UTC,2019-09-08 16:30:15 UTC
593,Education 499,2020-01-01 16:49:44 UTC,Nulla totam quod. Consequatur occaecati in. Dolores et reiciendis.,2019-09-08 16:30:15 UTC,2019-09-08 16:30:15 UTC
594,Computer Science 160,2019-10-20 13:56:01 UTC,Atque in ipsum. Eius nihil consequatur. In ullam distinctio.,2019-09-08 16:30:15 UTC,2019-09-08 16:30:15 UTC
595,Biological Science 290,2020-07-07 00:56:17 UTC,Animi ipsum placeat. Ut commodi quae. Corporis accusantium non.,2019-09-08 16:30:15 UTC,2019-09-08 16:30:15 UTC
596,Design 212,2020-03-08 10:45:11 UTC,Qui nulla consequatur. Libero nihil numquam. Qui ducimus et.,2019-09-08 16:30:15 UTC,2019-09-08 16:30:15 UTC
597,Psychology 511,2019-11-03 03:03:48 UTC,Est laborum deserunt. Et adipisci quia. Perferendis unde molestiae.,2019-09-08 16:30:15 UTC,2019-09-08 16:30:15 UTC
598,Engineering 412,2019-10-12 21:36:37 UTC,Delectus eligendi dolorum. Sed sunt porro. Sed deleniti recusandae.,2019-09-08 16:30:16 UTC,2019-09-08 16:30:16 UTC
599,Design 461,2020-06-02 09:59:51 UTC,Ipsa ut tenetur. Ut voluptas eveniet. Id sint possimus.,2019-09-08 16:30:16 UTC,2019-09-08 16:30:16 UTC
600,Biomedical Science 586,2020-03-01 05:11:53 UTC,Alias voluptatum omnis. Et quia eaque. Aperiam sed et.,2019-09-08 16:30:16 UTC,2019-09-08 16:30:16 UTC
601,Applied Science (Psychology) 181,2020-03-12 00:35:01 UTC,Fugit error perspiciatis. Mollitia vero ut. Pariatur quaerat odit.,2019-09-08 16:30:16 UTC,2019-09-08 16:30:16 UTC
602,Engineering 234,2020-04-12 00:33:13 UTC,Soluta repudiandae magnam. Suscipit id explicabo. Sed amet et.,2019-09-08 16:30:16 UTC,2019-09-08 16:30:16 UTC
603,Education 231,2020-01-06 13:08:27 UTC,Similique aut asperiores. Laborum ea tempora. Est id sint.,2019-09-08 16:30:16 UTC,2019-09-08 16:30:16 UTC
604,Applied Science (Psychology) 436,2020-03-27 13:09:24 UTC,Modi amet quis. Officia odit mollitia. Nulla voluptas possimus.,2019-09-08 16:30:16 UTC,2019-09-08 16:30:16 UTC
605,Communications 252,2019-10-12 05:29:53 UTC,Enim mollitia aut. Ratione quidem vitae. Porro hic quis.,2019-09-08 16:30:16 UTC,2019-09-08 16:30:16 UTC
606,Health Science 188,2020-01-06 14:58:44 UTC,Molestiae eum ut. Necessitatibus est excepturi. Eos soluta est.,2019-09-08 16:30:16 UTC,2019-09-08 16:30:16 UTC
607,Communications 464,2019-12-12 21:40:48 UTC,Quisquam nulla laboriosam. Aut esse quod. Tenetur dolor sunt.,2019-09-08 16:30:16 UTC,2019-09-08 16:30:16 UTC
608,Medicine 196,2020-03-07 01:36:27 UTC,Numquam dicta qui. Qui eum aut. Reprehenderit facilis ab.,2019-09-08 16:30:16 UTC,2019-09-08 16:30:16 UTC
609,Computer Science 447,2020-03-23 22:59:35 UTC,Et facilis consequatur. Expedita omnis sed. Ratione ut nulla.,2019-09-08 16:30:16 UTC,2019-09-08 16:30:16 UTC
610,Medicine 373,2020-01-07 12:36:49 UTC,Vitae in autem. Sint ea non. Rem iusto excepturi.,2019-09-08 16:30:16 UTC,2019-09-08 16:30:16 UTC
611,Health Science 424,2019-11-29 18:28:39 UTC,Optio placeat quis. Ipsa sit nostrum. Non voluptatem velit.,2019-09-08 16:30:16 UTC,2019-09-08 16:30:16 UTC
612,Health Science 333,2020-04-17 05:29:39 UTC,Inventore cumque et. Quod in et. Maiores officiis saepe.,2019-09-08 16:30:16 UTC,2019-09-08 16:30:16 UTC
613,Health Science 449,2020-02-21 13:52:50 UTC,Et sapiente explicabo. Eaque tempore laboriosam. Et doloremque eum.,2019-09-08 16:30:16 UTC,2019-09-08 16:30:16 UTC
614,Education 323,2020-01-29 22:22:09 UTC,Eligendi aut repellendus. Eos dolore corporis. Voluptatem ex recusandae.,2019-09-08 16:30:16 UTC,2019-09-08 16:30:16 UTC
615,Applied Science (Psychology) 248,2020-06-18 13:55:03 UTC,Fuga et ut. Consequuntur praesentium fugit. Sit veritatis asperiores.,2019-09-08 16:30:16 UTC,2019-09-08 16:30:16 UTC
616,Psychology 324,2019-11-19 19:19:45 UTC,Velit non sed. Nesciunt dolor non. Porro fugit fuga.,2019-09-08 16:30:16 UTC,2019-09-08 16:30:16 UTC
617,Psychology 176,2020-04-17 22:39:31 UTC,Sit laborum et. Nihil officiis et. Nihil nesciunt reprehenderit.,2019-09-08 16:30:16 UTC,2019-09-08 16:30:16 UTC
618,Communications 199,2020-04-18 08:15:22 UTC,Suscipit libero omnis. Necessitatibus ea et. Velit repellat temporibus.,2019-09-08 16:30:16 UTC,2019-09-08 16:30:16 UTC
619,Health Science 565,2020-01-06 04:08:54 UTC,Est omnis sed. Non aliquam omnis. Voluptate enim qui.,2019-09-08 16:30:16 UTC,2019-09-08 16:30:16 UTC
620,Medicine 411,2020-06-09 22:19:28 UTC,Nostrum eum est. Ut est voluptate. Laudantium magni inventore.,2019-09-08 16:30:16 UTC,2019-09-08 16:30:16 UTC
621,Arts 369,2020-06-15 16:50:41 UTC,Est est sed. At rem ut. Tenetur ex quidem.,2019-09-08 16:30:16 UTC,2019-09-08 16:30:16 UTC
622,Teaching 514,2019-11-05 10:14:25 UTC,Asperiores est consequatur. Quaerat voluptatem eius. At iusto nulla.,2019-09-08 16:30:16 UTC,2019-09-08 16:30:16 UTC
623,Forensic Science 166,2020-07-08 04:21:49 UTC,Molestiae labore repellat. Iste possimus quibusdam. Aut et rem.,2019-09-08 16:30:16 UTC,2019-09-08 16:30:16 UTC
624,Biomedical Science 344,2020-02-19 01:24:58 UTC,Suscipit ut accusamus. Est deleniti in. Vero sunt dolor.,2019-09-08 16:30:16 UTC,2019-09-08 16:30:16 UTC
625,Criminology 293,2020-03-12 03:49:40 UTC,Minus veritatis ea. Quis sed ad. Sed sequi voluptas.,2019-09-08 16:30:16 UTC,2019-09-08 16:30:16 UTC
626,Biomedical Science 327,2019-11-03 03:58:51 UTC,Est reprehenderit sunt. Quidem ut ipsa. Voluptatibus quia delectus.,2019-09-08 16:30:16 UTC,2019-09-08 16:30:16 UTC
627,Forensic Science 279,2020-01-04 16:08:43 UTC,Aspernatur aut tempora. Quisquam quis quia. Eos repellat qui.,2019-09-08 16:30:16 UTC,2019-09-08 16:30:16 UTC
628,Information Systems 496,2020-01-16 19:35:09 UTC,Explicabo dolor in. Officia illum perferendis. Harum amet ut.,2019-09-08 16:30:16 UTC,2019-09-08 16:30:16 UTC
629,Law 550,2019-11-19 18:55:34 UTC,Et animi commodi. Quia iste dolores. Necessitatibus est eius.,2019-09-08 16:30:16 UTC,2019-09-08 16:30:16 UTC
630,Communications 196,2019-11-16 03:07:02 UTC,Velit aperiam esse. Atque at et. Rem eos enim.,2019-09-08 16:30:16 UTC,2019-09-08 16:30:16 UTC
631,Arts 255,2020-05-17 01:42:17 UTC,Aut animi qui. Doloribus quis pariatur. Laboriosam inventore culpa.,2019-09-08 16:30:16 UTC,2019-09-08 16:30:16 UTC
632,Communications 198,2020-06-13 13:34:04 UTC,Modi itaque eum. Ut aliquid et. Officia distinctio recusandae.,2019-09-08 16:30:16 UTC,2019-09-08 16:30:16 UTC
633,Forensic Science 587,2020-05-01 19:08:01 UTC,Numquam vel laboriosam. Possimus quo vitae. Quos et numquam.,2019-09-08 16:30:16 UTC,2019-09-08 16:30:16 UTC
634,Medicine 352,2020-05-06 01:50:20 UTC,Cum ut ipsa. Nihil asperiores excepturi. Consequatur aut natus.,2019-09-08 16:30:16 UTC,2019-09-08 16:30:16 UTC
635,Commerce 358,2020-07-05 10:23:36 UTC,Unde dolores doloremque. Aliquid soluta est. Porro officia ratione.,2019-09-08 16:30:16 UTC,2019-09-08 16:30:16 UTC
636,Law 291,2020-04-04 11:38:06 UTC,Hic et iusto. Rerum corporis qui. Vero natus dolores.,2019-09-08 16:30:16 UTC,2019-09-08 16:30:16 UTC
637,Nursing 524,2020-06-22 10:13:32 UTC,Velit ad et. Eos suscipit quidem. Quasi adipisci pariatur.,2019-09-08 16:30:16 UTC,2019-09-08 16:30:16 UTC
638,Engineering 513,2019-11-12 12:56:45 UTC,Iste perferendis deleniti. Ut tenetur inventore. Quaerat quia quisquam.,2019-09-08 16:30:16 UTC,2019-09-08 16:30:16 UTC
639,Law 528,2019-12-25 14:09:56 UTC,Sequi eius dolorem. Omnis odio voluptas. Ut autem odio.,2019-09-08 16:30:16 UTC,2019-09-08 16:30:16 UTC
640,Biological Science 497,2020-05-23 15:35:47 UTC,Quo sit accusamus. Sunt est animi. Tenetur possimus expedita.,2019-09-08 16:30:16 UTC,2019-09-08 16:30:16 UTC
641,Psychology 521,2020-04-20 04:49:00 UTC,Sed doloremque odio. Explicabo est deleniti. Iste et ut.,2019-09-08 16:30:16 UTC,2019-09-08 16:30:16 UTC
642,Education 563,2020-02-12 12:43:30 UTC,Cum voluptatibus quod. Fugiat ducimus cumque. Voluptate nobis odit.,2019-09-08 16:30:16 UTC,2019-09-08 16:30:16 UTC
643,Computer Science 257,2020-03-26 01:36:09 UTC,Quia rerum quia. Enim perspiciatis quas. Quaerat quod distinctio.,2019-09-08 16:30:16 UTC,2019-09-08 16:30:16 UTC
644,Design 155,2019-11-04 05:09:32 UTC,Ex cumque fuga. In pariatur sint. Et ut eos.,2019-09-08 16:30:16 UTC,2019-09-08 16:30:16 UTC
645,Architectural Technology 345,2020-05-15 19:10:32 UTC,Ut laborum vel. Nesciunt quia nostrum. Perferendis aut cum.,2019-09-08 16:30:16 UTC,2019-09-08 16:30:16 UTC
646,Architectural Technology 554,2019-11-25 03:44:47 UTC,Neque eius sit. Ea expedita itaque. Quidem possimus exercitationem.,2019-09-08 16:30:16 UTC,2019-09-08 16:30:16 UTC
647,Criminology 398,2020-05-29 09:47:14 UTC,Omnis est est. Vitae quia hic. Non tempora et.,2019-09-08 16:30:16 UTC,2019-09-08 16:30:16 UTC
648,Design 352,2020-05-02 18:06:38 UTC,Maxime minima nobis. Numquam facere ut. Ea et voluptate.,2019-09-08 16:30:16 UTC,2019-09-08 16:30:16 UTC
649,Forensic Science 214,2019-11-16 01:00:43 UTC,Exercitationem velit ullam. Aut eos sapiente. Quisquam voluptate doloribus.,2019-09-08 16:30:16 UTC,2019-09-08 16:30:16 UTC
650,Biomedical Science 134,2019-12-02 11:29:24 UTC,Itaque ducimus incidunt. Aut cumque nam. Qui beatae et.,2019-09-08 16:30:16 UTC,2019-09-08 16:30:16 UTC
651,Forensic Science 497,2019-12-19 04:56:19 UTC,Vel assumenda omnis. Fugiat itaque et. Quidem sint accusantium.,2019-09-08 16:30:16 UTC,2019-09-08 16:30:16 UTC
652,Biomedical Science 154,2019-12-03 15:25:31 UTC,Ut et nemo. Nam illum et. Ab voluptas qui.,2019-09-08 16:30:16 UTC,2019-09-08 16:30:16 UTC
653,Criminology 394,2020-03-08 16:52:55 UTC,Velit ullam voluptatem. Consequuntur corrupti aut. Laborum libero nam.,2019-09-08 16:30:16 UTC,2019-09-08 16:30:16 UTC
654,Teaching 143,2019-11-28 23:44:23 UTC,Sunt ab autem. Facere rerum praesentium. Provident quis eius.,2019-09-08 16:30:16 UTC,2019-09-08 16:30:16 UTC
655,Law 473,2019-11-20 06:25:52 UTC,Distinctio in cumque. Possimus velit ea. Soluta quae hic.,2019-09-08 16:30:16 UTC,2019-09-08 16:30:16 UTC
656,Applied Science (Psychology) 360,2020-02-08 06:11:50 UTC,Quaerat cumque voluptas. Libero tenetur doloribus. Voluptatem iusto itaque.,2019-09-08 16:30:16 UTC,2019-09-08 16:30:16 UTC
657,Architectural Technology 497,2020-05-08 07:51:34 UTC,Beatae blanditiis ipsum. Est nihil vitae. Reiciendis nam sit.,2019-09-08 16:30:16 UTC,2019-09-08 16:30:16 UTC
658,Biomedical Science 561,2020-03-06 23:17:37 UTC,Porro architecto voluptates. Molestiae consequuntur porro. Possimus distinctio ipsa.,2019-09-08 16:30:16 UTC,2019-09-08 16:30:16 UTC
659,Commerce 236,2020-04-06 08:02:28 UTC,Quam sit voluptatem. Impedit id ut. Modi quis dolor.,2019-09-08 16:30:16 UTC,2019-09-08 16:30:16 UTC
660,Health Science 225,2020-05-09 09:49:59 UTC,Sequi necessitatibus et. Est ullam sit. Eligendi aut alias.,2019-09-08 16:30:16 UTC,2019-09-08 16:30:16 UTC
661,Law 293,2020-05-17 22:16:48 UTC,Facilis veniam cumque. Unde nemo qui. Omnis quia unde.,2019-09-08 16:30:16 UTC,2019-09-08 16:30:16 UTC
662,Forensic Science 191,2020-04-16 04:41:32 UTC,Quia est et. Sed reiciendis placeat. Aspernatur omnis officia.,2019-09-08 16:30:16 UTC,2019-09-08 16:30:16 UTC
