id,title,due_date,description,created_at,updated_at
332,Psychology 375,2020-02-02 05:36:35 UTC,Et tempora ex. Dolores aperiam eos. Velit vitae modi.,2019-09-08 16:30:10 UTC,2019-09-08 16:30:10 UTC
333,Computer Science 542,2019-12-16 23:10:55 UTC,Ducimus sed optio. Aliquid et non. Et ea veniam.,2019-09-08 16:30:10 UTC,2019-09-08 16:30:10 UTC
334,Design 532,2019-11-17 09:43:44 UTC,Sunt quae illum. Unde vitae sapiente. Et culpa officia.,2019-09-08 16:30:10 UTC,2019-09-08 16:30:10 UTC
335,Education 259,2019-10-31 22:04:09 UTC,At corporis corrupti. Sit consequatur tenetur. Perspiciatis ipsam ut.,2019-09-08 16:30:10 UTC,2019-09-08 16:30:10 UTC
336,Computer Science 349,2020-02-26 08:38:59 UTC,Eligendi reprehenderit quos. Nulla est culpa. A dolorem ullam.,2019-09-08 16:30:11 UTC,2019-09-08 16:30:11 UTC
337,Biological Science 122,2019-12-04 18:20:29 UTC,Commodi aspernatur molestiae. Voluptatem autem omnis. Hic vero reprehenderit.,2019-09-08 16:30:11 UTC,2019-09-08 16:30:11 UTC
338,Medicine 385,2020-06-16 13:15:49 UTC,Ut ut libero. Quod numquam deleniti. Est sed inventore.,2019-09-08 16:30:11 UTC,2019-09-08 16:30:11 UTC
339,Biomedical Science 521,2019-12-15 09:57:00 UTC,Eos omnis vitae. Et est voluptatem. Laborum totam accusantium.,2019-09-08 16:30:11 UTC,2019-09-08 16:30:11 UTC
340,Commerce 364,2020-04-13 19:38:25 UTC,Repudiandae est officiis. Fugiat mollitia omnis. Consequatur est velit.,2019-09-08 16:30:11 UTC,2019-09-08 16:30:11 UTC
341,Engineering 516,2020-03-10 01:44:00 UTC,Sunt exercitationem non. Aliquam ea ex. Reiciendis debitis ullam.,2019-09-08 16:30:11 UTC,2019-09-08 16:30:11 UTC
342,Business 539,2020-04-30 10:08:35 UTC,Dolorem doloremque ducimus. In aut soluta. Cumque natus ab.,2019-09-08 16:30:11 UTC,2019-09-08 16:30:11 UTC
343,Medicine 350,2020-01-04 13:20:03 UTC,Aut quia aut. Ex a expedita. Eos autem et.,2019-09-08 16:30:11 UTC,2019-09-08 16:30:11 UTC
344,Biological Science 195,2020-02-03 00:16:14 UTC,Et itaque vel. Dolorem temporibus quia. Odio ea excepturi.,2019-09-08 16:30:11 UTC,2019-09-08 16:30:11 UTC
345,Creative Arts 247,2020-04-27 15:11:34 UTC,In facilis iste. Eaque perferendis omnis. Rerum iusto reprehenderit.,2019-09-08 16:30:11 UTC,2019-09-08 16:30:11 UTC
346,Health Science 381,2019-11-21 01:20:06 UTC,Dolor quia et. Officia provident labore. Rem repellendus est.,2019-09-08 16:30:11 UTC,2019-09-08 16:30:11 UTC
347,Biological Science 318,2020-05-28 20:32:51 UTC,Sit atque ullam. Et illo rem. Sint reiciendis voluptatem.,2019-09-08 16:30:11 UTC,2019-09-08 16:30:11 UTC
348,Computer Science 435,2020-04-12 07:11:25 UTC,Dolorem maiores omnis. Aut est provident. Sint et voluptatem.,2019-09-08 16:30:11 UTC,2019-09-08 16:30:11 UTC
349,Design 235,2020-01-14 05:08:28 UTC,Fugit voluptatem omnis. Veritatis nostrum a. Nesciunt inventore ea.,2019-09-08 16:30:11 UTC,2019-09-08 16:30:11 UTC
350,Commerce 353,2020-04-21 15:51:20 UTC,Repudiandae vel quo. In quo minus. Vel qui tempora.,2019-09-08 16:30:11 UTC,2019-09-08 16:30:11 UTC
351,Health Science 389,2020-03-15 11:11:29 UTC,Quisquam et alias. Ut in voluptatibus. Quia fuga ut.,2019-09-08 16:30:11 UTC,2019-09-08 16:30:11 UTC
352,Health Science 173,2019-12-20 21:46:18 UTC,Culpa sed velit. Vero quia esse. Ea numquam explicabo.,2019-09-08 16:30:11 UTC,2019-09-08 16:30:11 UTC
353,Design 482,2020-04-07 18:37:39 UTC,Accusantium adipisci dolor. In explicabo consequatur. Perspiciatis dolorem unde.,2019-09-08 16:30:11 UTC,2019-09-08 16:30:11 UTC
354,Information Systems 375,2020-06-17 13:45:47 UTC,Qui voluptate rerum. Aspernatur voluptatem id. Omnis cupiditate modi.,2019-09-08 16:30:11 UTC,2019-09-08 16:30:11 UTC
355,Education 425,2019-12-17 04:24:41 UTC,Laboriosam qui velit. Et nulla eveniet. Quo sit in.,2019-09-08 16:30:11 UTC,2019-09-08 16:30:11 UTC
356,Criminology 190,2020-07-08 07:52:08 UTC,Possimus consequatur perferendis. Commodi deserunt accusantium. Facere minus blanditiis.,2019-09-08 16:30:11 UTC,2019-09-08 16:30:11 UTC
357,Psychology 579,2019-12-17 01:04:32 UTC,Deleniti esse ut. Velit sunt et. Pariatur rerum quis.,2019-09-08 16:30:11 UTC,2019-09-08 16:30:11 UTC
358,Architectural Technology 554,2020-07-01 19:18:33 UTC,Officia rerum sed. Blanditiis aut ipsum. Reprehenderit iusto rerum.,2019-09-08 16:30:11 UTC,2019-09-08 16:30:11 UTC
359,Commerce 586,2020-06-11 17:55:32 UTC,Et sequi corrupti. Delectus alias numquam. Praesentium dolor totam.,2019-09-08 16:30:11 UTC,2019-09-08 16:30:11 UTC
360,Health Science 279,2020-02-15 00:04:22 UTC,Totam sit eum. Enim reiciendis eos. Qui sunt temporibus.,2019-09-08 16:30:11 UTC,2019-09-08 16:30:11 UTC
361,Forensic Science 596,2019-12-08 22:35:49 UTC,Laudantium deserunt sint. Aut saepe rerum. Asperiores et rerum.,2019-09-08 16:30:11 UTC,2019-09-08 16:30:11 UTC
362,Teaching 367,2020-04-05 19:08:12 UTC,Est temporibus saepe. Itaque reiciendis qui. Aut cum voluptas.,2019-09-08 16:30:11 UTC,2019-09-08 16:30:11 UTC
363,Arts 586,2019-10-23 18:46:13 UTC,Quasi quo ea. Consequuntur dolor quis. Ut voluptas expedita.,2019-09-08 16:30:11 UTC,2019-09-08 16:30:11 UTC
364,Applied Science (Psychology) 320,2019-11-05 21:08:16 UTC,Qui qui laborum. Quam magnam totam. Laudantium perspiciatis quisquam.,2019-09-08 16:30:11 UTC,2019-09-08 16:30:11 UTC
365,Engineering 287,2019-11-10 11:40:45 UTC,Illum recusandae nostrum. Est quaerat aspernatur. Quia similique excepturi.,2019-09-08 16:30:11 UTC,2019-09-08 16:30:11 UTC
366,Criminology 583,2020-07-01 10:19:52 UTC,Est et et. Non autem est. Atque est ipsa.,2019-09-08 16:30:11 UTC,2019-09-08 16:30:11 UTC
367,Engineering 519,2019-12-15 19:59:20 UTC,Enim ut consequatur. Placeat vero natus. Debitis mollitia blanditiis.,2019-09-08 16:30:11 UTC,2019-09-08 16:30:11 UTC
368,Business 235,2020-01-12 10:01:48 UTC,Omnis qui quaerat. Qui nobis soluta. Voluptatem sunt voluptatem.,2019-09-08 16:30:11 UTC,2019-09-08 16:30:11 UTC
369,Law 438,2019-11-25 18:41:53 UTC,Id ipsam dolores. Aut quaerat commodi. Debitis quidem ea.,2019-09-08 16:30:11 UTC,2019-09-08 16:30:11 UTC
370,Health Science 325,2020-01-24 22:09:28 UTC,Quia cumque omnis. Perferendis possimus quasi. Autem rerum deleniti.,2019-09-08 16:30:11 UTC,2019-09-08 16:30:11 UTC
371,Arts 358,2020-04-08 00:52:16 UTC,Sint quia animi. Amet hic a. Dolorem hic id.,2019-09-08 16:30:11 UTC,2019-09-08 16:30:11 UTC
372,Creative Arts 288,2020-02-27 01:45:23 UTC,Vel nostrum odit. Et velit qui. Accusamus rerum ut.,2019-09-08 16:30:11 UTC,2019-09-08 16:30:11 UTC
373,Applied Science (Psychology) 376,2019-10-16 05:36:02 UTC,Veritatis odit dolorem. Quisquam et reprehenderit. Quia consequatur aperiam.,2019-09-08 16:30:11 UTC,2019-09-08 16:30:11 UTC
374,Architectural Technology 521,2019-10-18 20:21:23 UTC,Quia vel voluptatem. Et iusto dolores. Eum corporis in.,2019-09-08 16:30:11 UTC,2019-09-08 16:30:11 UTC
375,Applied Science (Psychology) 220,2020-06-12 18:13:11 UTC,Et nisi nihil. At a aliquid. Quas quis debitis.,2019-09-08 16:30:11 UTC,2019-09-08 16:30:11 UTC
376,Business 437,2020-07-03 18:16:33 UTC,Doloremque nam facere. Aut est ut. Ipsam et eum.,2019-09-08 16:30:11 UTC,2019-09-08 16:30:11 UTC
377,Business 252,2020-06-02 05:17:39 UTC,Atque rerum laudantium. Voluptas ut esse. Accusamus molestias libero.,2019-09-08 16:30:11 UTC,2019-09-08 16:30:11 UTC
378,Psychology 235,2020-06-01 15:28:43 UTC,Aliquam est sint. Qui cumque totam. Sit quo fugiat.,2019-09-08 16:30:11 UTC,2019-09-08 16:30:11 UTC
379,Teaching 189,2020-05-03 02:24:58 UTC,Voluptatem sequi omnis. Eaque itaque veniam. Sunt distinctio optio.,2019-09-08 16:30:11 UTC,2019-09-08 16:30:11 UTC
380,Computer Science 375,2020-03-14 12:34:19 UTC,Debitis quisquam voluptatibus. Magni soluta dolorem. Libero ea voluptatum.,2019-09-08 16:30:11 UTC,2019-09-08 16:30:11 UTC
381,Commerce 164,2020-03-17 22:22:35 UTC,Eum natus magnam. Enim architecto optio. Sit tenetur dolorem.,2019-09-08 16:30:11 UTC,2019-09-08 16:30:11 UTC
382,Engineering 536,2019-11-18 00:13:49 UTC,Et rerum et. Cupiditate praesentium veritatis. Fugit omnis et.,2019-09-08 16:30:11 UTC,2019-09-08 16:30:11 UTC
383,Teaching 219,2019-12-15 16:30:46 UTC,Enim et consequuntur. Architecto praesentium et. Ab in distinctio.,2019-09-08 16:30:11 UTC,2019-09-08 16:30:11 UTC
384,Computer Science 253,2019-12-10 23:41:27 UTC,Nobis voluptatibus laudantium. Blanditiis ea tempora. Est et consequatur.,2019-09-08 16:30:11 UTC,2019-09-08 16:30:11 UTC
385,Computer Science 442,2020-04-22 11:42:31 UTC,Nesciunt doloremque voluptate. Beatae voluptatum et. Odio accusantium ab.,2019-09-08 16:30:11 UTC,2019-09-08 16:30:11 UTC
386,Law 371,2020-02-16 08:33:40 UTC,Enim non reprehenderit. Soluta voluptate nobis. Facilis praesentium at.,2019-09-08 16:30:11 UTC,2019-09-08 16:30:11 UTC
387,Law 135,2020-03-16 06:31:45 UTC,Optio libero tempore. Ad aut laborum. Dolorem rerum pariatur.,2019-09-08 16:30:11 UTC,2019-09-08 16:30:11 UTC
388,Education 161,2020-03-27 09:02:55 UTC,Maiores velit dolorem. Harum rerum eos. Nihil repellendus libero.,2019-09-08 16:30:11 UTC,2019-09-08 16:30:11 UTC
389,Teaching 462,2019-12-16 04:09:06 UTC,Dolores beatae corrupti. Dolorem incidunt sed. Inventore reiciendis molestias.,2019-09-08 16:30:11 UTC,2019-09-08 16:30:11 UTC
390,Applied Science (Psychology) 594,2020-04-09 04:10:50 UTC,Porro nam qui. Illo minima sed. Nemo ab nulla.,2019-09-08 16:30:11 UTC,2019-09-08 16:30:11 UTC
391,Communications 116,2019-11-16 01:54:54 UTC,Consequatur ad ratione. Consequatur ut voluptatibus. Dicta consectetur vitae.,2019-09-08 16:30:11 UTC,2019-09-08 16:30:11 UTC
392,Design 228,2020-06-23 13:12:18 UTC,Beatae voluptate excepturi. Incidunt reprehenderit accusantium. Mollitia dolor nisi.,2019-09-08 16:30:12 UTC,2019-09-08 16:30:12 UTC
393,Health Science 245,2020-06-23 02:50:52 UTC,Non quaerat officia. Nisi et sequi. Ut ratione quaerat.,2019-09-08 16:30:12 UTC,2019-09-08 16:30:12 UTC
394,Design 133,2019-11-06 11:27:44 UTC,Omnis illum praesentium. Sit at modi. Tempore temporibus amet.,2019-09-08 16:30:12 UTC,2019-09-08 16:30:12 UTC
395,Applied Science (Psychology) 338,2020-01-26 20:09:09 UTC,Occaecati itaque accusantium. Nulla dolor deserunt. Quo maiores cupiditate.,2019-09-08 16:30:12 UTC,2019-09-08 16:30:12 UTC
396,Creative Arts 248,2020-07-01 15:59:57 UTC,Aut quidem consequuntur. Aperiam quia id. Ipsum ut qui.,2019-09-08 16:30:12 UTC,2019-09-08 16:30:12 UTC
397,Education 181,2020-04-13 12:45:08 UTC,Fuga tempora vel. Quae nisi rerum. Provident suscipit fugiat.,2019-09-08 16:30:12 UTC,2019-09-08 16:30:12 UTC
398,Arts 462,2019-11-04 11:28:48 UTC,Sed qui ipsam. Est laboriosam maxime. Beatae iure eum.,2019-09-08 16:30:12 UTC,2019-09-08 16:30:12 UTC
399,Biological Science 459,2019-11-18 19:00:15 UTC,Corporis laboriosam hic. Eaque voluptatem porro. Necessitatibus rem deleniti.,2019-09-08 16:30:12 UTC,2019-09-08 16:30:12 UTC
400,Biological Science 288,2019-12-27 03:56:18 UTC,Quo ducimus voluptatem. Sit blanditiis voluptatem. Dolore similique veritatis.,2019-09-08 16:30:12 UTC,2019-09-08 16:30:12 UTC
401,Arts 527,2019-12-07 02:25:52 UTC,Et earum ex. Minima consequatur accusamus. Dolores ex minima.,2019-09-08 16:30:12 UTC,2019-09-08 16:30:12 UTC
402,Communications 564,2019-11-24 21:26:46 UTC,Dolorem perferendis sequi. Eaque quia repellendus. At expedita dolores.,2019-09-08 16:30:12 UTC,2019-09-08 16:30:12 UTC
403,Health Science 554,2020-07-08 12:21:39 UTC,Quia voluptate qui. Mollitia dolorem dolor. Ut quia quia.,2019-09-08 16:30:12 UTC,2019-09-08 16:30:12 UTC
404,Teaching 295,2020-03-05 00:45:59 UTC,Harum ullam aut. Repellat amet aut. Deserunt et reiciendis.,2019-09-08 16:30:12 UTC,2019-09-08 16:30:12 UTC
405,Law 219,2019-10-30 19:03:59 UTC,Commodi quo dolor. Nihil at reprehenderit. Saepe neque necessitatibus.,2019-09-08 16:30:12 UTC,2019-09-08 16:30:12 UTC
406,Arts 578,2019-10-27 07:41:42 UTC,Omnis dolorem quia. Atque voluptatem ex. Reiciendis nulla dolores.,2019-09-08 16:30:12 UTC,2019-09-08 16:30:12 UTC
407,Commerce 277,2020-03-28 04:29:56 UTC,Eaque provident rem. Placeat est magni. Quos dicta excepturi.,2019-09-08 16:30:12 UTC,2019-09-08 16:30:12 UTC
408,Teaching 121,2019-11-17 05:16:32 UTC,Et ea magni. Iusto ut sed. Vero magnam non.,2019-09-08 16:30:12 UTC,2019-09-08 16:30:12 UTC
409,Criminology 273,2019-11-19 19:00:25 UTC,Necessitatibus perspiciatis delectus. Asperiores labore ipsa. Consequatur error rerum.,2019-09-08 16:30:12 UTC,2019-09-08 16:30:12 UTC
410,Nursing 391,2020-06-28 16:00:10 UTC,Voluptatem omnis corrupti. Et rerum qui. Distinctio perspiciatis possimus.,2019-09-08 16:30:12 UTC,2019-09-08 16:30:12 UTC
411,Psychology 310,2019-11-14 14:58:27 UTC,Id quas atque. Fugit et dolor. Sapiente dolorem alias.,2019-09-08 16:30:12 UTC,2019-09-08 16:30:12 UTC
412,Nursing 445,2020-04-24 15:23:12 UTC,Molestias qui quia. Non molestiae quo. Ex aut veritatis.,2019-09-08 16:30:12 UTC,2019-09-08 16:30:12 UTC
413,Commerce 251,2020-03-11 00:23:26 UTC,Minus voluptate error. Fugiat sit magnam. Voluptatem quis laborum.,2019-09-08 16:30:12 UTC,2019-09-08 16:30:12 UTC
414,Biological Science 133,2020-03-28 18:25:10 UTC,Nihil dolor dolorem. Autem voluptas dolores. Rerum et recusandae.,2019-09-08 16:30:12 UTC,2019-09-08 16:30:12 UTC
415,Medicine 575,2020-06-28 08:39:09 UTC,Quos et consectetur. Quia voluptatum eos. Aperiam aspernatur reiciendis.,2019-09-08 16:30:12 UTC,2019-09-08 16:30:12 UTC
416,Applied Science (Psychology) 523,2020-02-02 02:13:08 UTC,Est sunt et. Atque qui sed. Odio sit sed.,2019-09-08 16:30:12 UTC,2019-09-08 16:30:12 UTC
417,Nursing 520,2019-12-09 13:23:10 UTC,Exercitationem inventore et. Eos nulla adipisci. Odit omnis aut.,2019-09-08 16:30:12 UTC,2019-09-08 16:30:12 UTC
418,Education 189,2020-06-18 22:34:54 UTC,Commodi quidem voluptate. Minus et accusantium. Est nisi inventore.,2019-09-08 16:30:12 UTC,2019-09-08 16:30:12 UTC
419,Engineering 114,2020-04-15 19:38:35 UTC,Consequatur sit sed. Et quia sit. Sit enim dolor.,2019-09-08 16:30:12 UTC,2019-09-08 16:30:12 UTC
420,Arts 345,2020-05-21 13:34:19 UTC,Dolor ut magnam. Adipisci soluta qui. Omnis inventore ad.,2019-09-08 16:30:12 UTC,2019-09-08 16:30:12 UTC
421,Forensic Science 136,2020-01-30 21:27:00 UTC,Eum quis perspiciatis. Culpa aperiam ad. Impedit inventore modi.,2019-09-08 16:30:12 UTC,2019-09-08 16:30:12 UTC
422,Nursing 351,2020-06-24 04:16:06 UTC,Nesciunt vero quia. Et dolorem corrupti. Nesciunt animi odit.,2019-09-08 16:30:12 UTC,2019-09-08 16:30:12 UTC
423,Design 158,2020-05-21 09:59:16 UTC,Commodi omnis quae. Ea velit non. Ab et id.,2019-09-08 16:30:12 UTC,2019-09-08 16:30:12 UTC
424,Commerce 317,2020-04-26 16:49:06 UTC,Quaerat vel impedit. Ut odio perspiciatis. Voluptatem ducimus voluptatum.,2019-09-08 16:30:12 UTC,2019-09-08 16:30:12 UTC
425,Computer Science 335,2019-11-09 07:27:35 UTC,Incidunt perferendis consequuntur. Nam totam laborum. Dolorem ut facilis.,2019-09-08 16:30:12 UTC,2019-09-08 16:30:12 UTC
426,Psychology 296,2020-03-10 11:29:46 UTC,Et ut rerum. Harum veniam non. Deserunt et et.,2019-09-08 16:30:12 UTC,2019-09-08 16:30:12 UTC
427,Creative Arts 495,2020-03-27 09:12:50 UTC,Porro maxime non. Autem et alias. Natus reiciendis quis.,2019-09-08 16:30:12 UTC,2019-09-08 16:30:12 UTC
428,Criminology 115,2019-11-09 21:36:45 UTC,Aliquam laborum exercitationem. Quos cum delectus. Aperiam voluptas consequuntur.,2019-09-08 16:30:12 UTC,2019-09-08 16:30:12 UTC
429,Arts 367,2020-04-17 14:39:47 UTC,Debitis ea fugit. Autem fugit a. Laborum impedit atque.,2019-09-08 16:30:13 UTC,2019-09-08 16:30:13 UTC
430,Commerce 125,2020-05-30 05:12:22 UTC,Laboriosam enim rem. Impedit delectus et. Sunt unde itaque.,2019-09-08 16:30:13 UTC,2019-09-08 16:30:13 UTC
431,Health Science 235,2019-12-16 09:24:04 UTC,Dolorem neque nobis. Aut velit illum. Laboriosam magnam omnis.,2019-09-08 16:30:13 UTC,2019-09-08 16:30:13 UTC
432,Design 399,2020-03-01 08:24:52 UTC,Consequatur culpa facere. Tenetur doloremque itaque. Veniam voluptatum ullam.,2019-09-08 16:30:13 UTC,2019-09-08 16:30:13 UTC
433,Forensic Science 189,2020-03-16 21:19:01 UTC,Et aut repellendus. Est possimus dolor. Doloremque unde porro.,2019-09-08 16:30:13 UTC,2019-09-08 16:30:13 UTC
434,Biomedical Science 326,2020-04-20 15:29:27 UTC,In voluptas nulla. Et tenetur reprehenderit. Est possimus molestiae.,2019-09-08 16:30:13 UTC,2019-09-08 16:30:13 UTC
435,Teaching 156,2020-02-24 14:34:51 UTC,Expedita molestias corporis. Laudantium dolores incidunt. Beatae magni sed.,2019-09-08 16:30:13 UTC,2019-09-08 16:30:13 UTC
436,Business 226,2019-12-13 19:59:43 UTC,Et eos sed. Consequatur sequi iure. Dicta aut porro.,2019-09-08 16:30:13 UTC,2019-09-08 16:30:13 UTC
437,Applied Science (Psychology) 115,2020-01-20 20:59:07 UTC,Ut et quae. Fuga culpa aut. Magnam soluta facilis.,2019-09-08 16:30:13 UTC,2019-09-08 16:30:13 UTC
438,Information Systems 567,2019-11-01 19:23:53 UTC,Amet culpa nihil. Tempore et modi. Nesciunt eligendi quia.,2019-09-08 16:30:13 UTC,2019-09-08 16:30:13 UTC
439,Applied Science (Psychology) 187,2020-01-07 10:59:39 UTC,Non quia sed. Et delectus cum. Maxime iste id.,2019-09-08 16:30:13 UTC,2019-09-08 16:30:13 UTC
440,Arts 467,2020-04-13 14:26:30 UTC,Quam eaque consectetur. Adipisci sed quia. Explicabo esse perspiciatis.,2019-09-08 16:30:13 UTC,2019-09-08 16:30:13 UTC
441,Information Systems 263,2020-06-18 08:50:06 UTC,Quia ratione sunt. Perspiciatis aut et. Mollitia est ea.,2019-09-08 16:30:13 UTC,2019-09-08 16:30:13 UTC
442,Information Systems 378,2019-12-02 01:08:50 UTC,Repellat dolor debitis. Id ab laudantium. Et est voluptatem.,2019-09-08 16:30:13 UTC,2019-09-08 16:30:13 UTC
443,Biomedical Science 256,2020-03-25 14:20:28 UTC,Sit et voluptate. Error et in. Ipsam quia sit.,2019-09-08 16:30:13 UTC,2019-09-08 16:30:13 UTC
444,Communications 239,2020-02-18 03:54:48 UTC,Pariatur dignissimos corrupti. Culpa facere dolore. Mollitia labore veritatis.,2019-09-08 16:30:13 UTC,2019-09-08 16:30:13 UTC
445,Teaching 221,2019-10-11 13:37:54 UTC,Corporis hic quas. Voluptatem sint officia. Possimus qui amet.,2019-09-08 16:30:13 UTC,2019-09-08 16:30:13 UTC
446,Engineering 367,2020-05-30 01:58:59 UTC,Incidunt aliquid voluptates. Amet sed ipsa. Voluptatem ea sunt.,2019-09-08 16:30:13 UTC,2019-09-08 16:30:13 UTC
447,Medicine 312,2019-12-20 02:59:24 UTC,Cum sapiente aut. Corporis eaque ratione. Fugit laborum aut.,2019-09-08 16:30:13 UTC,2019-09-08 16:30:13 UTC
448,Teaching 394,2020-02-03 10:17:35 UTC,Eveniet natus dolorum. Ipsum quae odit. Temporibus aut est.,2019-09-08 16:30:13 UTC,2019-09-08 16:30:13 UTC
449,Biomedical Science 552,2020-04-29 16:13:22 UTC,Odio consequatur aut. Sit eligendi porro. Et quidem non.,2019-09-08 16:30:13 UTC,2019-09-08 16:30:13 UTC
450,Computer Science 120,2019-11-27 18:56:49 UTC,Rerum maiores deleniti. Totam hic perspiciatis. Cupiditate voluptatem quia.,2019-09-08 16:30:13 UTC,2019-09-08 16:30:13 UTC
451,Biomedical Science 115,2020-01-08 18:19:32 UTC,Id impedit repudiandae. Accusantium quos voluptas. Eos necessitatibus voluptatem.,2019-09-08 16:30:13 UTC,2019-09-08 16:30:13 UTC
452,Computer Science 511,2019-10-08 23:38:30 UTC,Explicabo et sunt. Non ullam voluptatem. Rerum molestiae aut.,2019-09-08 16:30:13 UTC,2019-09-08 16:30:13 UTC
453,Psychology 237,2020-06-23 17:45:55 UTC,Voluptas facilis distinctio. Consequatur eius expedita. Vel dolorem ut.,2019-09-08 16:30:13 UTC,2019-09-08 16:30:13 UTC
454,Commerce 515,2020-05-03 23:23:00 UTC,Nisi ipsa perferendis. Sed et quod. Ut quo exercitationem.,2019-09-08 16:30:13 UTC,2019-09-08 16:30:13 UTC
455,Business 323,2020-02-06 04:28:32 UTC,Et neque nesciunt. Ad rerum molestiae. Totam consectetur minus.,2019-09-08 16:30:13 UTC,2019-09-08 16:30:13 UTC
456,Communications 198,2020-05-17 15:16:39 UTC,Maiores odio dolorum. Ullam perspiciatis at. Laboriosam voluptas quibusdam.,2019-09-08 16:30:14 UTC,2019-09-08 16:30:14 UTC
457,Commerce 566,2020-07-02 04:38:52 UTC,Distinctio vitae quis. Tempora totam soluta. Provident debitis similique.,2019-09-08 16:30:14 UTC,2019-09-08 16:30:14 UTC
458,Psychology 459,2020-01-28 03:18:17 UTC,Consequatur mollitia nisi. Illo id a. Distinctio asperiores recusandae.,2019-09-08 16:30:14 UTC,2019-09-08 16:30:14 UTC
459,Criminology 577,2019-11-18 16:51:52 UTC,Reprehenderit vel earum. Voluptatem eligendi ut. Quas tempore id.,2019-09-08 16:30:14 UTC,2019-09-08 16:30:14 UTC
460,Information Systems 253,2019-12-04 18:53:34 UTC,Praesentium id inventore. Error totam quia. Rerum officiis ipsum.,2019-09-08 16:30:14 UTC,2019-09-08 16:30:14 UTC
461,Architectural Technology 313,2020-05-17 12:23:52 UTC,Ducimus eaque veritatis. Ea possimus suscipit. A provident alias.,2019-09-08 16:30:14 UTC,2019-09-08 16:30:14 UTC
462,Biomedical Science 566,2019-11-13 12:25:32 UTC,Repudiandae et nihil. Quibusdam voluptatem veniam. Esse veniam in.,2019-09-08 16:30:14 UTC,2019-09-08 16:30:14 UTC
463,Psychology 240,2019-12-02 18:17:43 UTC,Eligendi quasi omnis. Magni deserunt vero. Qui corporis quaerat.,2019-09-08 16:30:14 UTC,2019-09-08 16:30:14 UTC
464,Business 488,2019-12-26 16:26:28 UTC,Esse cupiditate deleniti. Numquam maxime voluptas. Repudiandae sit autem.,2019-09-08 16:30:14 UTC,2019-09-08 16:30:14 UTC
465,Arts 155,2019-12-11 14:30:35 UTC,Consectetur est quisquam. Omnis sequi non. Rem cum voluptas.,2019-09-08 16:30:14 UTC,2019-09-08 16:30:14 UTC
466,Engineering 221,2020-02-21 16:42:53 UTC,Non dignissimos rerum. Facilis numquam et. Et quae consequatur.,2019-09-08 16:30:14 UTC,2019-09-08 16:30:14 UTC
467,Forensic Science 366,2019-11-03 22:56:21 UTC,Dolore non laborum. Repudiandae aliquid a. Suscipit consequuntur quisquam.,2019-09-08 16:30:14 UTC,2019-09-08 16:30:14 UTC
468,Creative Arts 188,2020-02-05 09:47:40 UTC,Quos quam ratione. Inventore porro assumenda. Fugit soluta aut.,2019-09-08 16:30:14 UTC,2019-09-08 16:30:14 UTC
469,Medicine 335,2019-12-04 17:28:39 UTC,Qui laboriosam reprehenderit. Esse voluptatum quia. Occaecati eos voluptatem.,2019-09-08 16:30:14 UTC,2019-09-08 16:30:14 UTC
470,Medicine 263,2020-04-18 19:23:45 UTC,Sint tempore velit. Mollitia quia fuga. Sed id modi.,2019-09-08 16:30:14 UTC,2019-09-08 16:30:14 UTC
471,Education 123,2020-04-16 23:08:38 UTC,Molestias similique nam. Maxime nam ipsum. Unde ullam consectetur.,2019-09-08 16:30:14 UTC,2019-09-08 16:30:14 UTC
472,Teaching 373,2020-03-07 21:59:35 UTC,Quasi fugiat modi. Est officiis minima. Facere quae sapiente.,2019-09-08 16:30:14 UTC,2019-09-08 16:30:14 UTC
473,Biomedical Science 285,2019-11-28 14:14:17 UTC,Ut et deserunt. Esse aliquid qui. Alias voluptatibus et.,2019-09-08 16:30:14 UTC,2019-09-08 16:30:14 UTC
474,Engineering 252,2020-06-15 19:28:41 UTC,Ipsam beatae sunt. Aut ratione cum. Voluptates soluta totam.,2019-09-08 16:30:14 UTC,2019-09-08 16:30:14 UTC
475,Criminology 141,2019-12-30 05:26:28 UTC,Minus aut et. Ullam odit voluptatum. Voluptates quis ut.,2019-09-08 16:30:14 UTC,2019-09-08 16:30:14 UTC
476,Communications 186,2019-11-03 16:11:36 UTC,Optio dolores alias. Inventore quis maxime. Voluptatibus unde nostrum.,2019-09-08 16:30:14 UTC,2019-09-08 16:30:14 UTC
477,Psychology 352,2020-02-23 20:42:22 UTC,Eos ea ad. Perferendis laborum qui. Sint repellendus et.,2019-09-08 16:30:14 UTC,2019-09-08 16:30:14 UTC
478,Communications 424,2019-11-16 10:42:27 UTC,Dolor deserunt accusantium. Doloremque id autem. Accusamus est magnam.,2019-09-08 16:30:14 UTC,2019-09-08 16:30:14 UTC
479,Teaching 217,2019-12-10 08:12:51 UTC,Velit non dolorum. Vel voluptatem dolorum. Quia velit iusto.,2019-09-08 16:30:14 UTC,2019-09-08 16:30:14 UTC
480,Architectural Technology 271,2020-05-26 10:55:07 UTC,Eaque qui culpa. Natus tempora dignissimos. Consequatur quae iusto.,2019-09-08 16:30:14 UTC,2019-09-08 16:30:14 UTC
481,Engineering 320,2020-01-21 06:14:02 UTC,Expedita ipsam eum. Perferendis culpa nam. Qui corporis possimus.,2019-09-08 16:30:14 UTC,2019-09-08 16:30:14 UTC
482,Biomedical Science 365,2020-05-15 02:43:37 UTC,Tempora ipsum assumenda. Aperiam magni maiores. Praesentium cupiditate repudiandae.,2019-09-08 16:30:14 UTC,2019-09-08 16:30:14 UTC
483,Architectural Technology 138,2020-05-07 09:27:35 UTC,Quaerat modi eligendi. Tenetur harum molestias. Dolor modi et.,2019-09-08 16:30:14 UTC,2019-09-08 16:30:14 UTC
484,Business 368,2019-10-31 21:27:13 UTC,Facilis voluptatem quasi. Possimus quia ea. Dicta et sit.,2019-09-08 16:30:14 UTC,2019-09-08 16:30:14 UTC
485,Engineering 129,2019-11-11 15:20:22 UTC,Ea eos at. Alias nostrum quod. Tempora quisquam alias.,2019-09-08 16:30:14 UTC,2019-09-08 16:30:14 UTC
486,Architectural Technology 281,2019-11-27 04:11:45 UTC,Inventore nihil deserunt. Et itaque dolor. Et non aut.,2019-09-08 16:30:14 UTC,2019-09-08 16:30:14 UTC
487,Psychology 369,2020-02-29 01:28:03 UTC,Omnis voluptatem dolorem. Aut similique deserunt. Ab corrupti sint.,2019-09-08 16:30:14 UTC,2019-09-08 16:30:14 UTC
488,Computer Science 573,2020-04-30 22:18:23 UTC,Ut non ut. Aut ducimus consequatur. Nihil et quis.,2019-09-08 16:30:14 UTC,2019-09-08 16:30:14 UTC
489,Business 115,2020-02-14 01:58:54 UTC,Itaque praesentium nulla. Natus sit occaecati. Quia architecto dolor.,2019-09-08 16:30:14 UTC,2019-09-08 16:30:14 UTC
490,Law 519,2019-12-01 08:49:25 UTC,Eos nihil neque. Nobis qui voluptatem. Dicta excepturi qui.,2019-09-08 16:30:14 UTC,2019-09-08 16:30:14 UTC
491,Creative Arts 494,2019-12-24 23:13:07 UTC,Rerum velit labore. Ut culpa repellendus. Debitis voluptas sit.,2019-09-08 16:30:14 UTC,2019-09-08 16:30:14 UTC
492,Medicine 131,2020-05-02 15:25:14 UTC,Voluptate aperiam qui. Ipsum fuga delectus. Est soluta placeat.,2019-09-08 16:30:14 UTC,2019-09-08 16:30:14 UTC
493,Forensic Science 225,2020-06-24 05:40:37 UTC,Illo est laudantium. Provident voluptates eos. Mollitia nesciunt ut.,2019-09-08 16:30:14 UTC,2019-09-08 16:30:14 UTC
494,Biomedical Science 344,2019-11-02 12:36:23 UTC,Facilis minima rerum. Ipsum cupiditate pariatur. Quae vitae consequatur.,2019-09-08 16:30:14 UTC,2019-09-08 16:30:14 UTC
550,Engineering 410,2019-11-13 16:52:58 UTC,Exercitationem in at. Eum et velit. Quia libero enim.,2019-09-08 16:30:15 UTC,2019-09-08 16:30:15 UTC
495,Business 373,2019-12-06 18:30:50 UTC,Minima atque commodi. Voluptatum aliquid tempora. Amet cum et.,2019-09-08 16:30:14 UTC,2019-09-08 16:30:14 UTC
