id,title,due_date,description,created_at,updated_at
1,Psychology 567,2020-04-20 17:11:00 UTC,Iure eveniet fuga. Tempora officiis et. Et consequatur in.,2019-09-08 16:30:06 UTC,2019-09-08 16:30:06 UTC
2,Education 285,2020-01-13 04:47:26 UTC,Nesciunt at rem. Soluta accusantium adipisci. Aperiam dignissimos et.,2019-09-08 16:30:06 UTC,2019-09-08 16:30:06 UTC
3,Teaching 159,2019-10-29 07:49:38 UTC,Laboriosam accusamus iure. Animi praesentium pariatur. Eligendi quis animi.,2019-09-08 16:30:06 UTC,2019-09-08 16:30:06 UTC
4,Criminology 583,2020-03-15 16:33:13 UTC,Totam odit dignissimos. Aliquam enim delectus. Voluptatum alias possimus.,2019-09-08 16:30:06 UTC,2019-09-08 16:30:06 UTC
5,Information Systems 517,2019-11-13 14:37:28 UTC,Quam cum hic. Est et temporibus. Quidem neque et.,2019-09-08 16:30:06 UTC,2019-09-08 16:30:06 UTC
6,Education 283,2019-12-18 09:11:04 UTC,Delectus qui quibusdam. Reiciendis excepturi autem. Architecto et accusamus.,2019-09-08 16:30:06 UTC,2019-09-08 16:30:06 UTC
7,Information Systems 299,2020-06-19 03:55:55 UTC,Et voluptas qui. Sunt similique laboriosam. Quis qui iusto.,2019-09-08 16:30:06 UTC,2019-09-08 16:30:06 UTC
8,Design 531,2020-05-02 02:07:01 UTC,Et asperiores quidem. Voluptas facere explicabo. Aliquid ullam itaque.,2019-09-08 16:30:06 UTC,2019-09-08 16:30:06 UTC
9,Teaching 222,2020-01-18 00:36:35 UTC,Eos distinctio explicabo. Eaque culpa delectus. Quis aut assumenda.,2019-09-08 16:30:06 UTC,2019-09-08 16:30:06 UTC
10,Law 250,2020-05-12 11:06:31 UTC,Nemo aliquid dolore. Nulla est qui. Eum maiores fugiat.,2019-09-08 16:30:06 UTC,2019-09-08 16:30:06 UTC
11,Applied Science (Psychology) 232,2020-05-06 22:08:32 UTC,Asperiores consequatur ut. Voluptate officiis ut. Qui necessitatibus molestiae.,2019-09-08 16:30:06 UTC,2019-09-08 16:30:06 UTC
12,Criminology 164,2020-06-17 21:41:06 UTC,Cum adipisci aut. Sit aut voluptatum. Ratione error repellendus.,2019-09-08 16:30:06 UTC,2019-09-08 16:30:06 UTC
13,Biological Science 138,2020-04-07 05:23:10 UTC,Corrupti voluptatem mollitia. Occaecati facere qui. Quaerat facilis odio.,2019-09-08 16:30:06 UTC,2019-09-08 16:30:06 UTC
14,Teaching 437,2020-06-17 14:49:33 UTC,Nihil molestiae aut. Voluptas qui numquam. Asperiores dolore iure.,2019-09-08 16:30:06 UTC,2019-09-08 16:30:06 UTC
15,Arts 314,2020-05-14 07:55:21 UTC,In corporis eum. Qui laudantium et. Et at atque.,2019-09-08 16:30:06 UTC,2019-09-08 16:30:06 UTC
16,Applied Science (Psychology) 395,2020-03-13 04:46:33 UTC,Molestiae ipsum officia. Quibusdam iste blanditiis. Eius iusto facilis.,2019-09-08 16:30:06 UTC,2019-09-08 16:30:06 UTC
17,Arts 445,2019-10-29 14:42:45 UTC,Quisquam explicabo expedita. Voluptatem minima nemo. Est voluptatem quidem.,2019-09-08 16:30:06 UTC,2019-09-08 16:30:06 UTC
18,Psychology 444,2020-03-30 06:35:57 UTC,Deserunt qui minima. Ut vitae quia. Et dolore et.,2019-09-08 16:30:06 UTC,2019-09-08 16:30:06 UTC
19,Education 451,2020-01-13 15:49:56 UTC,Ducimus fuga nemo. Velit error et. Ducimus adipisci illum.,2019-09-08 16:30:06 UTC,2019-09-08 16:30:06 UTC
20,Criminology 378,2019-10-26 06:07:30 UTC,Omnis in similique. Velit minima et. Ratione asperiores ab.,2019-09-08 16:30:06 UTC,2019-09-08 16:30:06 UTC
21,Information Systems 323,2019-12-08 18:04:36 UTC,Praesentium nemo quasi. Rerum dolorum error. Quia praesentium sint.,2019-09-08 16:30:06 UTC,2019-09-08 16:30:06 UTC
22,Education 111,2019-10-18 09:34:40 UTC,Blanditiis enim eos. Est ut ipsam. Rem magni reiciendis.,2019-09-08 16:30:06 UTC,2019-09-08 16:30:06 UTC
23,Teaching 167,2019-11-20 10:57:39 UTC,Vitae tempore et. Sunt laudantium voluptatem. Aut ea rem.,2019-09-08 16:30:06 UTC,2019-09-08 16:30:06 UTC
24,Medicine 361,2019-12-04 23:08:41 UTC,Est voluptatibus ut. Quo iusto velit. Aut reprehenderit facere.,2019-09-08 16:30:06 UTC,2019-09-08 16:30:06 UTC
25,Criminology 332,2019-12-18 19:04:31 UTC,Voluptatem quam hic. Aliquam asperiores error. Tempora cupiditate soluta.,2019-09-08 16:30:06 UTC,2019-09-08 16:30:06 UTC
26,Biological Science 341,2019-11-11 03:56:34 UTC,Vero dolorum minus. Nulla dignissimos dolor. Perferendis similique rerum.,2019-09-08 16:30:06 UTC,2019-09-08 16:30:06 UTC
27,Criminology 349,2019-12-08 14:43:48 UTC,In voluptatem porro. Delectus tempore earum. Quam quas cumque.,2019-09-08 16:30:06 UTC,2019-09-08 16:30:06 UTC
28,Criminology 118,2019-12-28 08:35:56 UTC,Aperiam sint deserunt. Ab architecto id. Aut eveniet optio.,2019-09-08 16:30:06 UTC,2019-09-08 16:30:06 UTC
29,Biological Science 317,2020-02-23 13:54:27 UTC,Dicta non sint. Nihil hic veniam. Sint mollitia ipsam.,2019-09-08 16:30:06 UTC,2019-09-08 16:30:06 UTC
30,Criminology 463,2020-04-23 02:56:31 UTC,Quia alias in. Consequatur perspiciatis est. Ullam aut labore.,2019-09-08 16:30:06 UTC,2019-09-08 16:30:06 UTC
31,Health Science 364,2020-03-25 05:41:36 UTC,Qui blanditiis eaque. Rerum quidem ut. Exercitationem sequi veritatis.,2019-09-08 16:30:06 UTC,2019-09-08 16:30:06 UTC
32,Forensic Science 491,2019-10-18 10:08:10 UTC,Quis ad optio. Possimus est a. Aut impedit quo.,2019-09-08 16:30:06 UTC,2019-09-08 16:30:06 UTC
33,Creative Arts 280,2020-05-29 21:38:49 UTC,Porro sed et. Ab animi repudiandae. Quis rerum nemo.,2019-09-08 16:30:06 UTC,2019-09-08 16:30:06 UTC
34,Forensic Science 442,2019-10-13 05:58:07 UTC,Et perspiciatis voluptas. Eius nostrum itaque. Doloremque aut quas.,2019-09-08 16:30:06 UTC,2019-09-08 16:30:06 UTC
35,Teaching 495,2020-02-17 00:04:22 UTC,Ut natus voluptate. Exercitationem quisquam temporibus. Nostrum ea labore.,2019-09-08 16:30:06 UTC,2019-09-08 16:30:06 UTC
36,Communications 239,2020-03-15 08:49:35 UTC,Iste quidem et. Et veniam voluptatem. Rerum totam suscipit.,2019-09-08 16:30:06 UTC,2019-09-08 16:30:06 UTC
37,Design 294,2019-11-06 20:38:14 UTC,Autem rem enim. Et consectetur perspiciatis. Rerum consequatur itaque.,2019-09-08 16:30:06 UTC,2019-09-08 16:30:06 UTC
38,Biological Science 466,2020-03-04 23:02:34 UTC,Dolor error est. Eos consequatur et. Voluptatem fugit porro.,2019-09-08 16:30:06 UTC,2019-09-08 16:30:06 UTC
39,Engineering 513,2020-06-29 14:43:45 UTC,Sunt corporis ea. Sed iusto voluptas. Nobis sed cumque.,2019-09-08 16:30:06 UTC,2019-09-08 16:30:06 UTC
40,Architectural Technology 530,2020-04-23 02:16:39 UTC,Incidunt cumque autem. Unde nihil qui. Velit et expedita.,2019-09-08 16:30:06 UTC,2019-09-08 16:30:06 UTC
41,Design 181,2020-05-15 01:54:50 UTC,Ipsum aut sed. Unde incidunt nihil. Totam facere itaque.,2019-09-08 16:30:06 UTC,2019-09-08 16:30:06 UTC
42,Arts 189,2020-05-20 22:36:16 UTC,Accusamus dolores earum. Sint facilis beatae. Non numquam ea.,2019-09-08 16:30:06 UTC,2019-09-08 16:30:06 UTC
43,Arts 283,2019-11-13 08:49:11 UTC,Quod fuga libero. Vero voluptate error. Est aliquid modi.,2019-09-08 16:30:06 UTC,2019-09-08 16:30:06 UTC
44,Biological Science 174,2019-12-13 17:20:14 UTC,Veritatis omnis soluta. Esse dolor recusandae. Commodi repellat vel.,2019-09-08 16:30:06 UTC,2019-09-08 16:30:06 UTC
45,Information Systems 239,2020-07-02 19:51:23 UTC,Cumque earum eius. Est expedita quibusdam. Aut qui unde.,2019-09-08 16:30:06 UTC,2019-09-08 16:30:06 UTC
46,Nursing 293,2020-03-24 23:15:00 UTC,Earum accusamus asperiores. Ratione ab nostrum. Atque sint magnam.,2019-09-08 16:30:06 UTC,2019-09-08 16:30:06 UTC
47,Design 337,2019-10-30 13:11:08 UTC,Aliquam sequi dolorum. Facere et aut. Doloremque a omnis.,2019-09-08 16:30:06 UTC,2019-09-08 16:30:06 UTC
48,Psychology 528,2020-06-14 22:36:32 UTC,Ex nobis nam. Quo numquam facilis. Facere blanditiis numquam.,2019-09-08 16:30:06 UTC,2019-09-08 16:30:06 UTC
49,Law 378,2020-05-20 06:06:50 UTC,Sint facilis deserunt. Sint suscipit assumenda. Reiciendis voluptatum quidem.,2019-09-08 16:30:06 UTC,2019-09-08 16:30:06 UTC
50,Architectural Technology 574,2019-12-08 05:27:39 UTC,Est harum vel. Quia aspernatur aut. Consequuntur molestias et.,2019-09-08 16:30:06 UTC,2019-09-08 16:30:06 UTC
51,Law 268,2020-03-17 17:40:21 UTC,Quia qui molestias. Sapiente qui blanditiis. Dolorum vel ea.,2019-09-08 16:30:06 UTC,2019-09-08 16:30:06 UTC
52,Engineering 157,2020-04-23 17:08:43 UTC,Quibusdam eligendi et. Quas rerum in. Ducimus iure aliquam.,2019-09-08 16:30:06 UTC,2019-09-08 16:30:06 UTC
53,Business 497,2020-02-04 08:52:22 UTC,Odio facere ea. Maxime impedit quod. Excepturi repellat dolores.,2019-09-08 16:30:06 UTC,2019-09-08 16:30:06 UTC
54,Criminology 111,2019-10-31 08:31:33 UTC,Et non ut. Hic et natus. Cumque nulla ratione.,2019-09-08 16:30:06 UTC,2019-09-08 16:30:06 UTC
55,Computer Science 585,2019-10-15 01:28:21 UTC,Consequuntur aspernatur ut. Ullam harum ut. Eaque id cumque.,2019-09-08 16:30:06 UTC,2019-09-08 16:30:06 UTC
56,Engineering 342,2020-03-29 03:25:25 UTC,Possimus aliquam quos. Et placeat nemo. Distinctio quo beatae.,2019-09-08 16:30:06 UTC,2019-09-08 16:30:06 UTC
57,Communications 416,2020-02-09 20:40:10 UTC,Repellendus corrupti tempore. Dolorum quasi eaque. Dolorem amet similique.,2019-09-08 16:30:07 UTC,2019-09-08 16:30:07 UTC
58,Engineering 485,2020-01-13 18:30:54 UTC,Aspernatur itaque rerum. Inventore nihil voluptas. Est doloremque dolore.,2019-09-08 16:30:07 UTC,2019-09-08 16:30:07 UTC
59,Criminology 154,2020-06-26 10:23:45 UTC,Iste et optio. Earum sequi commodi. Quas dolor quasi.,2019-09-08 16:30:07 UTC,2019-09-08 16:30:07 UTC
60,Forensic Science 369,2020-04-12 16:04:40 UTC,Rem est aut. Adipisci amet quia. Sit magni quia.,2019-09-08 16:30:07 UTC,2019-09-08 16:30:07 UTC
61,Health Science 156,2020-03-31 14:13:10 UTC,Sunt libero quod. Et autem optio. Voluptatem vel odit.,2019-09-08 16:30:07 UTC,2019-09-08 16:30:07 UTC
62,Creative Arts 526,2019-12-01 01:35:48 UTC,Officiis repudiandae suscipit. Pariatur id fugit. Iusto facere eveniet.,2019-09-08 16:30:07 UTC,2019-09-08 16:30:07 UTC
63,Biological Science 322,2020-03-01 19:00:18 UTC,Earum illo nostrum. Architecto ut laudantium. Quis quia mollitia.,2019-09-08 16:30:07 UTC,2019-09-08 16:30:07 UTC
64,Forensic Science 417,2019-12-19 16:58:01 UTC,Qui exercitationem sed. Sint quasi qui. Officiis sequi nesciunt.,2019-09-08 16:30:07 UTC,2019-09-08 16:30:07 UTC
65,Design 431,2020-05-22 23:47:30 UTC,Hic fuga nemo. Et quo praesentium. Eos asperiores esse.,2019-09-08 16:30:07 UTC,2019-09-08 16:30:07 UTC
66,Architectural Technology 467,2019-11-18 16:39:03 UTC,Maxime sed error. Quos pariatur voluptatem. Ad sapiente quia.,2019-09-08 16:30:07 UTC,2019-09-08 16:30:07 UTC
67,Engineering 341,2019-11-16 00:23:06 UTC,Laboriosam maxime ut. Natus impedit aliquam. Assumenda et vel.,2019-09-08 16:30:07 UTC,2019-09-08 16:30:07 UTC
68,Communications 534,2020-03-08 23:01:06 UTC,Reprehenderit in quaerat. Labore eveniet aperiam. Dolor non officia.,2019-09-08 16:30:07 UTC,2019-09-08 16:30:07 UTC
69,Health Science 219,2019-11-19 14:43:07 UTC,Aut consectetur tempore. Expedita rerum amet. Nam pariatur ullam.,2019-09-08 16:30:07 UTC,2019-09-08 16:30:07 UTC
70,Teaching 225,2020-01-15 12:57:43 UTC,Quas voluptatem quo. Sunt iusto illum. Laborum placeat beatae.,2019-09-08 16:30:07 UTC,2019-09-08 16:30:07 UTC
71,Psychology 324,2020-04-12 23:48:31 UTC,Vel neque autem. Esse repellat aut. Dicta ex quia.,2019-09-08 16:30:07 UTC,2019-09-08 16:30:07 UTC
72,Arts 522,2019-10-16 02:10:17 UTC,Dicta fuga consequuntur. Quam ut corrupti. Atque ut deserunt.,2019-09-08 16:30:07 UTC,2019-09-08 16:30:07 UTC
73,Communications 551,2020-03-03 05:43:33 UTC,Accusamus eum excepturi. Rem est doloremque. Et maiores aspernatur.,2019-09-08 16:30:07 UTC,2019-09-08 16:30:07 UTC
74,Education 519,2019-12-29 09:39:26 UTC,Doloremque consectetur suscipit. Quaerat aut architecto. Debitis quas animi.,2019-09-08 16:30:07 UTC,2019-09-08 16:30:07 UTC
75,Arts 240,2020-01-05 23:58:13 UTC,Rerum voluptatem perferendis. Iste hic vitae. Quasi neque reprehenderit.,2019-09-08 16:30:07 UTC,2019-09-08 16:30:07 UTC
76,Communications 550,2019-10-11 01:54:03 UTC,Quas soluta doloremque. Delectus laudantium deserunt. Aut sed ut.,2019-09-08 16:30:07 UTC,2019-09-08 16:30:07 UTC
77,Biomedical Science 350,2019-12-02 06:23:59 UTC,Numquam dignissimos delectus. Molestiae ut nobis. Accusamus et et.,2019-09-08 16:30:07 UTC,2019-09-08 16:30:07 UTC
78,Design 523,2020-01-18 06:24:11 UTC,Sunt reiciendis est. At quod ut. Et quidem optio.,2019-09-08 16:30:07 UTC,2019-09-08 16:30:07 UTC
79,Business 439,2020-02-14 06:30:44 UTC,Beatae esse nobis. Quidem officiis voluptas. Qui illo molestiae.,2019-09-08 16:30:07 UTC,2019-09-08 16:30:07 UTC
80,Criminology 135,2020-06-26 08:45:53 UTC,Provident quo quae. Quo modi dolores. Velit alias a.,2019-09-08 16:30:07 UTC,2019-09-08 16:30:07 UTC
81,Information Systems 410,2019-12-01 13:18:57 UTC,Vel quos perspiciatis. Veniam quia non. Debitis sed animi.,2019-09-08 16:30:07 UTC,2019-09-08 16:30:07 UTC
82,Education 312,2020-01-14 06:55:48 UTC,Corporis vel ab. Autem aut voluptatem. Qui nam quo.,2019-09-08 16:30:07 UTC,2019-09-08 16:30:07 UTC
83,Medicine 136,2020-05-31 07:37:27 UTC,Incidunt inventore aut. Quia animi qui. Iste quia qui.,2019-09-08 16:30:07 UTC,2019-09-08 16:30:07 UTC
84,Communications 121,2020-01-14 06:15:06 UTC,Ea laborum tempora. Temporibus nihil perspiciatis. Id non qui.,2019-09-08 16:30:07 UTC,2019-09-08 16:30:07 UTC
85,Commerce 428,2020-03-28 09:26:06 UTC,Expedita aut quis. Eos et voluptas. Enim nulla quasi.,2019-09-08 16:30:07 UTC,2019-09-08 16:30:07 UTC
86,Biomedical Science 548,2020-01-28 16:09:24 UTC,Occaecati aut nihil. Eligendi qui et. Aut molestiae minima.,2019-09-08 16:30:07 UTC,2019-09-08 16:30:07 UTC
87,Design 338,2020-04-13 17:10:38 UTC,Quos sapiente vitae. Dolores consequatur soluta. Perspiciatis dolor odit.,2019-09-08 16:30:07 UTC,2019-09-08 16:30:07 UTC
88,Medicine 597,2020-02-20 01:39:38 UTC,Nisi modi est. Accusamus adipisci iste. Possimus et accusantium.,2019-09-08 16:30:07 UTC,2019-09-08 16:30:07 UTC
89,Health Science 515,2020-05-27 02:35:08 UTC,Sed non voluptates. Fugiat laudantium delectus. Doloremque facere ullam.,2019-09-08 16:30:07 UTC,2019-09-08 16:30:07 UTC
90,Forensic Science 581,2020-04-05 12:49:01 UTC,Aut in tenetur. Velit dolore ut. Quos et doloribus.,2019-09-08 16:30:07 UTC,2019-09-08 16:30:07 UTC
91,Criminology 463,2019-12-19 10:57:20 UTC,Voluptatem sequi autem. Suscipit deleniti placeat. Autem eaque et.,2019-09-08 16:30:07 UTC,2019-09-08 16:30:07 UTC
92,Creative Arts 397,2020-06-03 04:49:18 UTC,Nesciunt delectus voluptatibus. Est totam ipsum. Vel reprehenderit odio.,2019-09-08 16:30:07 UTC,2019-09-08 16:30:07 UTC
93,Biological Science 428,2019-12-06 16:56:02 UTC,Asperiores autem iusto. Dolores aut non. Repellat quod dignissimos.,2019-09-08 16:30:07 UTC,2019-09-08 16:30:07 UTC
94,Nursing 278,2020-06-02 05:47:04 UTC,Ut sequi praesentium. Vel et sequi. Totam doloremque numquam.,2019-09-08 16:30:07 UTC,2019-09-08 16:30:07 UTC
95,Medicine 480,2020-07-02 16:31:51 UTC,Suscipit ullam inventore. Asperiores hic explicabo. Molestias recusandae id.,2019-09-08 16:30:07 UTC,2019-09-08 16:30:07 UTC
96,Criminology 225,2020-06-27 21:07:19 UTC,Aliquam qui ab. Voluptas odio culpa. Sint recusandae occaecati.,2019-09-08 16:30:07 UTC,2019-09-08 16:30:07 UTC
97,Psychology 569,2020-02-18 12:13:06 UTC,Hic veritatis accusamus. Laborum ex voluptas. Voluptatum aliquid modi.,2019-09-08 16:30:07 UTC,2019-09-08 16:30:07 UTC
98,Nursing 490,2019-12-07 14:46:43 UTC,Sunt quia consequuntur. Tempora iusto omnis. Quae ullam sunt.,2019-09-08 16:30:07 UTC,2019-09-08 16:30:07 UTC
99,Engineering 185,2020-06-21 21:37:15 UTC,Omnis officiis sapiente. Excepturi at minima. Temporibus ullam ratione.,2019-09-08 16:30:07 UTC,2019-09-08 16:30:07 UTC
100,Engineering 160,2020-04-06 23:24:27 UTC,Cum tempore nemo. Iusto sequi impedit. Cumque placeat dolorem.,2019-09-08 16:30:07 UTC,2019-09-08 16:30:07 UTC
101,Computer Science 316,2020-01-28 14:38:52 UTC,Aut et laboriosam. Nesciunt qui aut. Cum quibusdam mollitia.,2019-09-08 16:30:07 UTC,2019-09-08 16:30:07 UTC
102,Teaching 457,2020-02-10 05:56:14 UTC,Eligendi quia dolores. Necessitatibus consectetur et. Qui molestiae ratione.,2019-09-08 16:30:07 UTC,2019-09-08 16:30:07 UTC
103,Information Systems 299,2019-11-26 12:48:32 UTC,Voluptas pariatur nihil. Quos sequi facilis. Aperiam ut voluptatem.,2019-09-08 16:30:07 UTC,2019-09-08 16:30:07 UTC
104,Law 599,2020-02-25 11:21:16 UTC,Quae ut enim. Sint autem quia. Sed eum libero.,2019-09-08 16:30:07 UTC,2019-09-08 16:30:07 UTC
105,Nursing 552,2020-07-03 05:07:05 UTC,Debitis sequi et. Amet beatae tempora. Consequatur et voluptatem.,2019-09-08 16:30:07 UTC,2019-09-08 16:30:07 UTC
106,Information Systems 589,2020-02-21 01:02:48 UTC,Nihil voluptatum ut. Qui minus ex. Quis illo odio.,2019-09-08 16:30:07 UTC,2019-09-08 16:30:07 UTC
107,Commerce 473,2019-11-10 20:13:46 UTC,Non repudiandae voluptatum. Tenetur soluta quia. Vel architecto odio.,2019-09-08 16:30:08 UTC,2019-09-08 16:30:08 UTC
108,Teaching 596,2019-12-12 14:59:05 UTC,Eaque earum omnis. Aliquid sed placeat. Et laudantium aperiam.,2019-09-08 16:30:08 UTC,2019-09-08 16:30:08 UTC
109,Teaching 550,2020-02-05 06:27:15 UTC,Delectus et necessitatibus. Eos ipsum a. Pariatur qui porro.,2019-09-08 16:30:08 UTC,2019-09-08 16:30:08 UTC
110,Computer Science 210,2020-05-02 20:47:33 UTC,Non voluptatem odit. Recusandae culpa quaerat. Quia libero magnam.,2019-09-08 16:30:08 UTC,2019-09-08 16:30:08 UTC
111,Nursing 347,2020-05-21 12:53:44 UTC,Odio modi ut. Cum ad atque. Labore et maiores.,2019-09-08 16:30:08 UTC,2019-09-08 16:30:08 UTC
112,Information Systems 532,2020-06-27 17:06:25 UTC,Placeat voluptas autem. Minima laborum nobis. Ducimus quia cumque.,2019-09-08 16:30:08 UTC,2019-09-08 16:30:08 UTC
113,Architectural Technology 244,2019-11-12 00:27:21 UTC,Nihil aut voluptas. Quis necessitatibus sint. Omnis et molestiae.,2019-09-08 16:30:08 UTC,2019-09-08 16:30:08 UTC
114,Engineering 219,2020-01-21 05:01:24 UTC,Natus architecto et. Exercitationem quibusdam qui. Doloremque aut et.,2019-09-08 16:30:08 UTC,2019-09-08 16:30:08 UTC
115,Forensic Science 413,2020-06-02 07:06:00 UTC,Ea nisi saepe. Rerum quas impedit. Nulla illo et.,2019-09-08 16:30:08 UTC,2019-09-08 16:30:08 UTC
116,Biological Science 563,2020-04-27 16:25:36 UTC,Dolore odio doloribus. Accusantium corrupti placeat. Quis atque excepturi.,2019-09-08 16:30:08 UTC,2019-09-08 16:30:08 UTC
117,Forensic Science 478,2020-02-07 05:56:55 UTC,Vero temporibus quo. Maxime quis neque. Nostrum sint debitis.,2019-09-08 16:30:08 UTC,2019-09-08 16:30:08 UTC
118,Applied Science (Psychology) 554,2019-11-24 00:19:17 UTC,Est accusantium eos. Nemo modi ducimus. Ad nulla accusantium.,2019-09-08 16:30:08 UTC,2019-09-08 16:30:08 UTC
119,Forensic Science 488,2019-11-04 04:59:10 UTC,Et labore praesentium. Veniam voluptatem illo. Nisi ipsam hic.,2019-09-08 16:30:08 UTC,2019-09-08 16:30:08 UTC
120,Business 571,2020-04-22 12:02:36 UTC,Aliquid eveniet facere. Est quia est. Dolores vel dolorem.,2019-09-08 16:30:08 UTC,2019-09-08 16:30:08 UTC
121,Health Science 242,2019-10-20 09:30:04 UTC,Itaque qui eligendi. Doloribus qui nesciunt. Minus qui sit.,2019-09-08 16:30:08 UTC,2019-09-08 16:30:08 UTC
122,Education 135,2019-10-20 22:16:48 UTC,Dolorem autem et. Non velit est. Blanditiis aperiam natus.,2019-09-08 16:30:08 UTC,2019-09-08 16:30:08 UTC
123,Teaching 525,2019-11-05 21:46:41 UTC,Voluptatem praesentium placeat. Fuga similique id. Sequi dolor quaerat.,2019-09-08 16:30:08 UTC,2019-09-08 16:30:08 UTC
124,Health Science 241,2020-03-27 10:21:19 UTC,Sed vel in. Similique repellat quae. Ut eius rerum.,2019-09-08 16:30:08 UTC,2019-09-08 16:30:08 UTC
125,Teaching 468,2019-11-14 06:44:18 UTC,Perferendis est ad. Esse necessitatibus atque. Aliquam nihil sit.,2019-09-08 16:30:08 UTC,2019-09-08 16:30:08 UTC
126,Architectural Technology 595,2020-07-02 21:49:55 UTC,Dolorum pariatur adipisci. Accusantium placeat et. Mollitia voluptate sed.,2019-09-08 16:30:08 UTC,2019-09-08 16:30:08 UTC
127,Business 443,2020-01-10 18:56:35 UTC,Non in corrupti. Quia mollitia natus. Pariatur placeat ea.,2019-09-08 16:30:08 UTC,2019-09-08 16:30:08 UTC
128,Law 591,2019-10-20 01:05:47 UTC,Laborum omnis dolor. Aut dolor incidunt. Maxime recusandae ut.,2019-09-08 16:30:08 UTC,2019-09-08 16:30:08 UTC
129,Communications 219,2020-04-23 09:30:26 UTC,Eius perferendis rerum. Nisi a dolore. Facilis et explicabo.,2019-09-08 16:30:08 UTC,2019-09-08 16:30:08 UTC
130,Business 388,2019-11-05 01:30:30 UTC,Ea maiores aut. Facilis repudiandae quia. Nemo placeat voluptas.,2019-09-08 16:30:08 UTC,2019-09-08 16:30:08 UTC
131,Forensic Science 496,2020-03-24 00:58:14 UTC,Sunt voluptatem qui. Porro deleniti voluptates. Rem architecto laborum.,2019-09-08 16:30:08 UTC,2019-09-08 16:30:08 UTC
132,Computer Science 523,2020-06-22 20:48:18 UTC,Voluptas in et. Fuga error et. Sunt quisquam omnis.,2019-09-08 16:30:08 UTC,2019-09-08 16:30:08 UTC
133,Medicine 470,2020-07-06 08:19:31 UTC,Aut et ipsa. Officiis sequi omnis. Voluptatem provident est.,2019-09-08 16:30:08 UTC,2019-09-08 16:30:08 UTC
134,Architectural Technology 399,2020-06-09 21:49:31 UTC,Earum et alias. Et tempora rerum. Consequuntur cum voluptatem.,2019-09-08 16:30:08 UTC,2019-09-08 16:30:08 UTC
135,Creative Arts 388,2020-01-19 12:07:38 UTC,Vel odio est. Nobis et atque. Recusandae voluptas et.,2019-09-08 16:30:08 UTC,2019-09-08 16:30:08 UTC
136,Arts 125,2019-10-24 20:28:48 UTC,Et atque et. Sit nam deleniti. Optio consequatur assumenda.,2019-09-08 16:30:08 UTC,2019-09-08 16:30:08 UTC
137,Computer Science 563,2020-02-04 20:16:23 UTC,Sunt debitis sunt. Sit ea quis. Quaerat ut nostrum.,2019-09-08 16:30:08 UTC,2019-09-08 16:30:08 UTC
138,Information Systems 519,2019-11-02 12:54:58 UTC,Illum quia sequi. Laboriosam voluptas quia. Totam sit similique.,2019-09-08 16:30:08 UTC,2019-09-08 16:30:08 UTC
139,Commerce 245,2020-04-29 09:03:53 UTC,Quidem id et. Qui nihil quis. Adipisci et aut.,2019-09-08 16:30:08 UTC,2019-09-08 16:30:08 UTC
140,Information Systems 230,2020-03-26 13:06:21 UTC,Laboriosam quibusdam rerum. Sunt consequatur at. Non corrupti magnam.,2019-09-08 16:30:08 UTC,2019-09-08 16:30:08 UTC
141,Medicine 431,2019-11-29 10:09:45 UTC,Voluptatem quo rerum. Repudiandae repellendus fugiat. Sed dolorem repellat.,2019-09-08 16:30:08 UTC,2019-09-08 16:30:08 UTC
142,Architectural Technology 433,2020-06-21 00:54:35 UTC,Quisquam fugiat nam. Doloribus aut dolore. Molestiae et earum.,2019-09-08 16:30:08 UTC,2019-09-08 16:30:08 UTC
143,Business 510,2020-04-24 00:05:56 UTC,Ipsum et quos. Dolores alias quos. In atque quae.,2019-09-08 16:30:08 UTC,2019-09-08 16:30:08 UTC
144,Arts 367,2019-11-06 14:41:43 UTC,Officiis aut voluptatem. Perferendis facilis consequatur. Repudiandae distinctio accusamus.,2019-09-08 16:30:08 UTC,2019-09-08 16:30:08 UTC
145,Teaching 596,2020-06-26 18:36:05 UTC,Quos quod aspernatur. Ut quae hic. Dolorem illum necessitatibus.,2019-09-08 16:30:08 UTC,2019-09-08 16:30:08 UTC
146,Information Systems 294,2019-11-27 00:34:44 UTC,Provident qui corporis. Tempore in veritatis. Reiciendis et tempore.,2019-09-08 16:30:08 UTC,2019-09-08 16:30:08 UTC
147,Education 580,2020-03-03 18:43:56 UTC,Aut in dolore. Est similique repellendus. Consequuntur consequatur qui.,2019-09-08 16:30:08 UTC,2019-09-08 16:30:08 UTC
148,Business 126,2019-12-15 21:39:39 UTC,Est enim sunt. Magni vero sunt. Nihil dolores aut.,2019-09-08 16:30:08 UTC,2019-09-08 16:30:08 UTC
149,Psychology 450,2020-06-27 11:37:35 UTC,Dolores qui sunt. Iure reiciendis corporis. Neque mollitia quod.,2019-09-08 16:30:08 UTC,2019-09-08 16:30:08 UTC
150,Law 589,2019-12-03 18:22:10 UTC,Consequatur sit qui. Officia consequuntur fugiat. Tenetur fugiat dignissimos.,2019-09-08 16:30:08 UTC,2019-09-08 16:30:08 UTC
151,Commerce 497,2020-04-10 06:59:10 UTC,Ipsam velit nihil. Explicabo in deserunt. Aperiam libero saepe.,2019-09-08 16:30:08 UTC,2019-09-08 16:30:08 UTC
152,Applied Science (Psychology) 265,2020-04-17 06:26:32 UTC,Officia temporibus ad. Ratione et recusandae. Iure illum maiores.,2019-09-08 16:30:08 UTC,2019-09-08 16:30:08 UTC
153,Education 152,2019-12-03 00:45:35 UTC,Est quo minima. Aut delectus suscipit. Sed rerum quas.,2019-09-08 16:30:08 UTC,2019-09-08 16:30:08 UTC
154,Computer Science 189,2019-12-30 10:21:00 UTC,Ut nam quis. Perferendis consequatur est. Voluptatem ut non.,2019-09-08 16:30:08 UTC,2019-09-08 16:30:08 UTC
155,Law 191,2020-06-02 15:05:43 UTC,Ut dolor magni. Voluptatibus doloremque corporis. Cumque doloribus similique.,2019-09-08 16:30:08 UTC,2019-09-08 16:30:08 UTC
156,Business 552,2020-02-06 17:00:08 UTC,Tempora sunt autem. Velit dolor nobis. Neque nisi in.,2019-09-08 16:30:08 UTC,2019-09-08 16:30:08 UTC
157,Creative Arts 359,2019-11-19 14:29:34 UTC,Eaque temporibus qui. Reiciendis voluptatibus non. Voluptas id neque.,2019-09-08 16:30:08 UTC,2019-09-08 16:30:08 UTC
158,Communications 487,2019-11-29 23:59:57 UTC,Deleniti ipsam necessitatibus. Quas et similique. Repellendus aut et.,2019-09-08 16:30:08 UTC,2019-09-08 16:30:08 UTC
159,Information Systems 182,2020-03-12 07:42:14 UTC,Fugiat temporibus voluptas. Natus porro officia. Dolores quidem ea.,2019-09-08 16:30:08 UTC,2019-09-08 16:30:08 UTC
160,Education 524,2020-01-05 12:14:06 UTC,Repellat suscipit voluptates. Aliquam praesentium autem. Ratione sunt laudantium.,2019-09-08 16:30:08 UTC,2019-09-08 16:30:08 UTC
161,Commerce 261,2020-01-02 02:13:41 UTC,Est est sed. In vero et. Repudiandae iure molestiae.,2019-09-08 16:30:08 UTC,2019-09-08 16:30:08 UTC
162,Creative Arts 270,2020-02-01 10:09:10 UTC,Nulla possimus quisquam. Ut et error. Consequatur aut quidem.,2019-09-08 16:30:08 UTC,2019-09-08 16:30:08 UTC
163,Medicine 369,2020-05-13 14:44:15 UTC,Quaerat ipsam aut. Distinctio vitae et. Similique voluptatem recusandae.,2019-09-08 16:30:08 UTC,2019-09-08 16:30:08 UTC
164,Biomedical Science 533,2020-03-18 17:10:51 UTC,Aperiam nesciunt dignissimos. Et voluptatum cum. Quo delectus rerum.,2019-09-08 16:30:08 UTC,2019-09-08 16:30:08 UTC
165,Teaching 416,2020-07-02 20:41:23 UTC,Voluptas inventore esse. Sunt tenetur et. Sunt ducimus est.,2019-09-08 16:30:08 UTC,2019-09-08 16:30:08 UTC
166,Biomedical Science 256,2020-02-02 03:18:11 UTC,Fuga consequatur aspernatur. Non corporis eligendi. Ipsa dignissimos commodi.,2019-09-08 16:30:08 UTC,2019-09-08 16:30:08 UTC
